Branch Name,Types,Business Status,City,Province,Region,Address,Latitude,Longitude,Rating,User Ratings Count,Place ID,Google Maps Link
BDO ATM - Shell San Ildefonso,ATM,OPERATIONAL,San Ildefonso,Bulacan,Central Luzon,"3WHR+V3Q Shell Station, 1, San Ildefonso, 3010 Bulakan, Philippines",15.0797048,120.9402208,4.5,2,ChIJ4_ROrEsClzMRka2M5LOVKsI,https://www.google.com/maps/place/?q=place_id:ChIJ4_ROrEsClzMRka2M5LOVKsI
BDO Jethro Gas Station San Ildefonso Bulacan ATM,ATM,OPERATIONAL,San Ildefonso,Bulacan,Central Luzon,"G/F between 7-11 Store and Infinitea Cagayan Valley Road Barangay Malimpang, San Ildefonso, 3010 Bulacan, Philippines",15.0722381,120.9428383,,,ChIJFXdv4HsDlzMRNOUjN7LRUI4,https://www.google.com/maps/place/?q=place_id:ChIJFXdv4HsDlzMRNOUjN7LRUI4
BDO Shell San Ildefonso ATM,ATM,OPERATIONAL,San Miguel,Bulacan,Central Luzon,"Shell Service Station, Beside Coffee Shop, G/F, Cagayan Valley Rd, San Ildefonso, Bulacan, Philippines",15.1343254,120.9698803,1,1,ChIJZQZzHVIdlzMRV6zV2jUtRlU,https://www.google.com/maps/place/?q=place_id:ChIJZQZzHVIdlzMRV6zV2jUtRlU
BDO Alfamart Malipangpang San Ildefonso ATM,ATM,OPERATIONAL,San Ildefonso,Bulacan,Central Luzon,"G/F Selling Area beside Counter Brgy, San Ildefonso, Bulacan, Philippines",15.0604622,120.9391791,,,ChIJMfDBS5UDlzMRbC0coVJd3is,https://www.google.com/maps/place/?q=place_id:ChIJMfDBS5UDlzMRbC0coVJd3is
BDO Shell San Rafael,Bank,OPERATIONAL,San Rafael,Bulacan,Central Luzon,"The Casobey, Shell Station, Km. 61 Cagayan Valley Road, Galas, San Rafael, Bulacan, Philippines",15.0365358,120.9373032,4,2,ChIJqWt0opgBlzMRSJIGWxienOE,https://www.google.com/maps/place/?q=place_id:ChIJqWt0opgBlzMRSJIGWxienOE
Banco de Oro (BDO),Bank,OPERATIONAL,San Miguel,Bulacan,Central Luzon,"5X5F+CFC, 1, San Miguel, Bulacan, Philippines",15.1585613,120.9736444,2.4,12,ChIJUw9j-WQclzMR7aYp6DrWlSw,https://www.google.com/maps/place/?q=place_id:ChIJUw9j-WQclzMR7aYp6DrWlSw
BDO ATM - Bulacan – San Rafael,Bank,OPERATIONAL,San Rafael,Bulacan,Central Luzon,"Km 60, Cagayan Valley Road, Cruz na Daan, San Rafael Bulacan, AH26, San Rafael, Bulakan, Philippines",15.0275248,120.9348979,,,ChIJDyllQoQBlzMRB7xeQHk9DcY,https://www.google.com/maps/place/?q=place_id:ChIJDyllQoQBlzMRB7xeQHk9DcY
Bdo,Bank,OPERATIONAL,Santa Maria,Bulacan,Central Luzon,"2 Gov Fortunato Halili Ave, Santa Maria, 3022 Bulacan, Philippines",14.8160336,120.9510702,,,ChIJmTGCaK6tlzMRkcMQEtc9TW8,https://www.google.com/maps/place/?q=place_id:ChIJmTGCaK6tlzMRkcMQEtc9TW8
BDO Cabanatuan - NE Pacific Mall Branch,Bank,OPERATIONAL,Cabanatuan City,Nueva Ecija,Central Luzon,"GF, Unit PA 5 & 6, NE Pacific Mall, Maharlika Highway, Cabanatuan City, Philippines",15.4600009,120.9503354,2.9,10,ChIJrXcbxI4olzMR3ohfcI5tiWw,https://www.google.com/maps/place/?q=place_id:ChIJrXcbxI4olzMR3ohfcI5tiWw
BDO SM City Cabanatuan Branch,Bank,OPERATIONAL,Cabanatuan City,Nueva Ecija,Central Luzon,"U/GF SM City Cabanatuan, Maharlika Highway Brgy, Cabanatuan City, Nueva Ecija, Philippines",15.4661872,120.954421,2.1,16,ChIJF1-1n98plzMR9ZZeObpUPAs,https://www.google.com/maps/place/?q=place_id:ChIJF1-1n98plzMR9ZZeObpUPAs
BDO Cabanatuan - Maharlika Highway North Branch,Bank,OPERATIONAL,Cabanatuan City,Nueva Ecija,Central Luzon,"G/F DGS Bldg. along Maharlika Road, Cabanatuan City, Nueva Ecija, Philippines",15.5002254,120.9803762,,,ChIJbQyate8plzMRWbEMfMbGhE4,https://www.google.com/maps/place/?q=place_id:ChIJbQyate8plzMRWbEMfMbGhE4
BDO Robinsons Townville - Cabanatuan Branch,Bank,OPERATIONAL,Cabanatuan City,Nueva Ecija,Central Luzon,"G/F Unit RA1, Robinsons Townville Brgy. H. Concepcion, Km. 111, 1, Cabanatuan City, 3100 Nueva Ecija, Philippines",15.4937079,120.9759782,1.7,3,ChIJPyV_zCoplzMRI_F9-ggbO90,https://www.google.com/maps/place/?q=place_id:ChIJPyV_zCoplzMRI_F9-ggbO90
BDO Waltermart - Cabanatuan Branch,Bank,OPERATIONAL,Cabanatuan City,Nueva Ecija,Central Luzon,"G/F Waltermart Cabantauan Brgy, Cabanatuan City, Nueva Ecija, Philippines",15.4861418,120.9717673,2.2,10,ChIJE1THINMplzMRuKqx5r7brN8,https://www.google.com/maps/place/?q=place_id:ChIJE1THINMplzMRuKqx5r7brN8
BDO - Maharlika Hi-way North,Bank,OPERATIONAL,Cabanatuan City,Nueva Ecija,Central Luzon,"26 Asian Highway, Cabanatuan City, 3120 Nueva Ecija, Philippines",15.4972916,120.9762555,2.3,3,ChIJle2CgTAplzMRf0ZINpETNTw,https://www.google.com/maps/place/?q=place_id:ChIJle2CgTAplzMRf0ZINpETNTw
BDO Cabanatuan - Maharlika South Branch,Bank,OPERATIONAL,Cabanatuan City,Nueva Ecija,Central Luzon,"BDO Building, Maharlika Highway Barangay, Cabanatuan City, Nueva Ecija, Philippines",15.4844628,120.9675999,4.8,10,ChIJf_zed98olzMRB_jIHSF69hw,https://www.google.com/maps/place/?q=place_id:ChIJf_zed98olzMRB_jIHSF69hw
BDO SM Megacenter Cabanatuan Branch,Bank,OPERATIONAL,Cabanatuan City,Nueva Ecija,Central Luzon,"Unit 49-B UG/F SM Megacenter Gen. Tinio &, Melencio Street Extension, Cabanatuan City, Nueva Ecija, Philippines",15.4883713,120.9685364,1.7,12,ChIJl02A_iAplzMRjNQmxWsxI68,https://www.google.com/maps/place/?q=place_id:ChIJl02A_iAplzMRjNQmxWsxI68
BDO Cabanatuan - Paco Roman Branch,ATM,OPERATIONAL,Cabanatuan City,Nueva Ecija,Central Luzon,"Along, Paco Roman Street, Cabanatuan City, Nueva Ecija, Philippines",15.486707,120.9644413,3.5,6,ChIJd36R9h8plzMRx-RzqbgZ3JE,https://www.google.com/maps/place/?q=place_id:ChIJd36R9h8plzMRx-RzqbgZ3JE
BDO Nueva Ecija - Sta. Rosa,Bank,OPERATIONAL,Santa Rosa,Nueva Ecija,Central Luzon,"Along Maharlika Highway, Sta. Rosa, Nueva Ecija, Along Maharlika Hwy, Santa Rosa, Nueva Ecija, Philippines",15.4258761,120.9380458,5,2,ChIJSzk4vbUnlzMRruSlMpvb8Zw,https://www.google.com/maps/place/?q=place_id:ChIJSzk4vbUnlzMRruSlMpvb8Zw
BDO ATM - NE Pacific Mall,Bank,OPERATIONAL,Cabanatuan City,Nueva Ecija,Central Luzon,"FW6X+3FX, NE Pacific Mall, Maharlika Highway, Cabanatuan City, Cabanatuan City, Philippines",15.4602386,120.9487438,4,1,ChIJHQAhwo4olzMREhQG6vrdyzE,https://www.google.com/maps/place/?q=place_id:ChIJHQAhwo4olzMREhQG6vrdyzE
BDO SM City Cabanatuan Department Store Selling Area 1 ATM,ATM,OPERATIONAL,Cabanatuan City,Nueva Ecija,Central Luzon,"G/F SM City Cabanatuan Maharlika Highway, Brgy, Cabanatuan City, Nueva Ecija, Philippines",15.4644253,120.9503744,4,1,ChIJOZTcIlEplzMRiWKpXgHjdTs,https://www.google.com/maps/place/?q=place_id:ChIJOZTcIlEplzMRiWKpXgHjdTs
BDO Nueva Ecija - CityMall Sta Rosa Branch,Bank,OPERATIONAL,Santa Rosa,Nueva Ecija,Central Luzon,"T-23 & 24, CityMall-Sta. Rosa, 1, Santa Rosa, Nueva Ecija, Philippines",15.4235229,120.9392619,4,8,ChIJYWmbrSsnlzMR5J1Nq6YHB9Q,https://www.google.com/maps/place/?q=place_id:ChIJYWmbrSsnlzMR5J1Nq6YHB9Q
BDO SM City Cabanatuan Department Store Back Office ATM,ATM,OPERATIONAL,Cabanatuan City,Nueva Ecija,Central Luzon,"3/F, Dept Store Back Office (near Supervisor's Locker Rm SM Store, Maharlika Hwy, Brgy, Cabanatuan City, Nueva Ecija, Philippines",15.4669482,120.955154,1,2,ChIJUcboOSQplzMRKz1lKHDNOMg,https://www.google.com/maps/place/?q=place_id:ChIJUcboOSQplzMRKz1lKHDNOMg
BDO Nueva Ecija - Gapan Branch,Bank,OPERATIONAL,Gapan City,Nueva Ecija,Central Luzon,"3105 Tinio St, Gapan City, 3105 Nueva Ecija, Philippines",15.3107807,120.9475419,3,4,ChIJl0Xx-LEhlzMREZM3o6RLXLs,https://www.google.com/maps/place/?q=place_id:ChIJl0Xx-LEhlzMREZM3o6RLXLs
BDO Nueva Ecija - Gapan Maharlika Highway Branch,Bank,OPERATIONAL,Gapan City,Nueva Ecija,Central Luzon,"8W2X+2G6, Units 3-7 Maharlika Highway, corner Sampaguita St, Gapan City, Nueva Ecija, Philippines",15.2999391,120.9479403,1.7,7,ChIJR1g31rIhlzMROOFE69HoWik,https://www.google.com/maps/place/?q=place_id:ChIJR1g31rIhlzMROOFE69HoWik
BDO Network Bank,Bank,OPERATIONAL,Bongabon,Nueva Ecija,Central Luzon,"Purok 3 KKH BLDG Brgy, Bongabon, 3128 Nueva Ecija, Philippines",15.6303016,121.145646,3,4,ChIJZWRteyDNkDMRslGvsy5dY4s,https://www.google.com/maps/place/?q=place_id:ChIJZWRteyDNkDMRslGvsy5dY4s
BDO Waltermart - Talavera Branch,ATM,OPERATIONAL,Talavera,Nueva Ecija,Central Luzon,"Unit WMT G-32, G/F Waltermart Talavera, Maharlika Highway, Brgy, Talavera, 3144 Nueva Ecija, Philippines",15.5734282,120.9208083,3.1,15,ChIJlbFSIe0qlzMR-7cs5uc8ZGM,https://www.google.com/maps/place/?q=place_id:ChIJlbFSIe0qlzMR-7cs5uc8ZGM
Banco De Oro - Nueva Ecija-Talavera,Bank,OPERATIONAL,Talavera,Nueva Ecija,Central Luzon,"HWP9+CW2, 1, Talavera, 3114 Nueva Ecija, Philippines",15.5860674,120.9195706,4.4,8,ChIJE2ysJu0qlzMRpA009xiXTEE,https://www.google.com/maps/place/?q=place_id:ChIJE2ysJu0qlzMRpA009xiXTEE
BDO Primark Cabiao,Bank,OPERATIONAL,Cabiao,Nueva Ecija,Central Luzon,"7V25+5GJ, Cabiao, Nueva Ecija, Philippines",15.250454,120.8587603,3,5,ChIJu7zaZ3rhljMRA_ZrLGHMXek,https://www.google.com/maps/place/?q=place_id:ChIJu7zaZ3rhljMRA_ZrLGHMXek
BDO Nueva Ecija - Muñoz Branch,Bank,OPERATIONAL,Muñoz,Nueva Ecija,Central Luzon,"T, Delos Santos St, Muñoz, Nueva Ecija, Philippines",15.7130061,120.9033262,4.6,11,ChIJ4f92HmvXkDMRWvZD0D_-jC0,https://www.google.com/maps/place/?q=place_id:ChIJ4f92HmvXkDMRWvZD0D_-jC0
BDO Nueva Ecija - Zaragoza Branch,Bank,OPERATIONAL,Zaragoza,Nueva Ecija,Central Luzon,"Along, Santa Rosa - Tarlac Rd, Brgy, Zaragoza, Nueva Ecija, Philippines",15.449256,120.7940157,2.8,13,ChIJ39HLnyLaljMROF4Gk3HQpnU,https://www.google.com/maps/place/?q=place_id:ChIJ39HLnyLaljMROF4Gk3HQpnU
BDO Nueva Ecija - San Jose Branch,Bank,OPERATIONAL,San Jose City,Nueva Ecija,Central Luzon,"221 1, San Jose City, 3121 Nueva Ecija, Philippines",15.7927044,120.9904905,4,11,ChIJv_2Zpx_akDMRFk3zIYph-N8,https://www.google.com/maps/place/?q=place_id:ChIJv_2Zpx_akDMRFk3zIYph-N8
Bdo Network Bank,Bank,OPERATIONAL,Aliaga,Nueva Ecija,Central Luzon,"FRXQ+MW6, Guimba - Aliaga Rd, Aliaga, Nueva Ecija, Philippines",15.499162,120.8397672,3.5,2,ChIJsfrbogTXljMRXj_YdOe0zWo,https://www.google.com/maps/place/?q=place_id:ChIJsfrbogTXljMRXj_YdOe0zWo
BDO Network Bank - San Leonardo Branch,Bank,OPERATIONAL,San Leonardo,Nueva Ecija,Central Luzon,"GPG Commercial Building, 2 Diversion Rd, Barangay Diversion, San Leonardo, 3102 Nueva Ecija, Philippines",15.3633377,120.9398211,5,1,ChIJ70Q7UU0hlzMR2KyuiSO7hI0,https://www.google.com/maps/place/?q=place_id:ChIJ70Q7UU0hlzMR2KyuiSO7hI0
BDO Nueva Ecija - Guimba Branch,Bank,OPERATIONAL,Guimba,Nueva Ecija,Central Luzon,"Afan Salvador St, Guimba, Nueva Ecija, Philippines",15.6594776,120.7655254,3.5,10,ChIJg3LfK9wskTMR6OEh2YycE4g,https://www.google.com/maps/place/?q=place_id:ChIJg3LfK9wskTMR6OEh2YycE4g
BDO Nueva Ecija - Talavera Branch,Bank,OPERATIONAL,Matnog,Sorsogon,Bicol Region,"G/F RDL Square 1 Bldg., Maharlika Highway Brgy, Poblacion, Talavera, 3114 Nueva Ecija, Philippines",12.6679167,123.9881642,,,ChIJgSCr6gvPoDMRIYBKKUT9nSA,https://www.google.com/maps/place/?q=place_id:ChIJgSCr6gvPoDMRIYBKKUT9nSA
BDO Tarlac - Paniqui Branch,Bank,OPERATIONAL,Paniqui,Tarlac,Central Luzon,"MHCP+P36 M.H. Del Pilar Street, MacArthur Hwy, Paniqui, 2307 Tarlac, Philippines",15.6717876,120.5850634,3.4,5,ChIJWxBQvNI1kTMRmTbpj02YUtg,https://www.google.com/maps/place/?q=place_id:ChIJWxBQvNI1kTMRmTbpj02YUtg
BDO Nueva Ecija - Sta. Rosa Branch,Bank,OPERATIONAL,Matnog,Sorsogon,Bicol Region,"Along, 1, Santa Rosa, Nueva Ecija, Philippines",12.6679167,123.9881642,,,ChIJrUeTh07PoDMRlimrRbyqVf8,https://www.google.com/maps/place/?q=place_id:ChIJrUeTh07PoDMRlimrRbyqVf8
BDO VDRE Inc. - Nueva Ecija ATM,ATM,OPERATIONAL,San Leonardo,Nueva Ecija,Central Luzon,"KM102, Maharlika Hwy, San Leonardo, 3102 Nueva Ecija, Philippines",15.3811748,120.9411152,,,ChIJiWIqN9onlzMRt_0UCFeQ8As,https://www.google.com/maps/place/?q=place_id:ChIJiWIqN9onlzMRt_0UCFeQ8As
Banco De Oro,ATM,OPERATIONAL,Jaen,Nueva Ecija,Central Luzon,"GF Savemore Market Jaen Jaen 3109 Nueva Ecija, Jaen, Nueva Ecija, Philippines",15.3389833,120.9119024,2.5,2,ChIJ68GhAYkhlzMRoA92xlds8E4,https://www.google.com/maps/place/?q=place_id:ChIJ68GhAYkhlzMRoA92xlds8E4
BDO Network Bank,Bank,OPERATIONAL,Jaen,Nueva Ecija,Central Luzon,"8WP5+QX3, Provincial Road, Jaen, Nueva Ecija, Philippines",15.3369316,120.9099029,4,1,ChIJ4RJuzI8glzMRYIQBOsVMKwk,https://www.google.com/maps/place/?q=place_id:ChIJ4RJuzI8glzMRYIQBOsVMKwk
"BDO Santo Domingo, Nueva Ecija",Bank,OPERATIONAL,Santo Domingo,Nueva Ecija,Central Luzon,"HVMH+P89, Santo Domingo, Nueva Ecija, Philippines",15.5842814,120.8783989,5,1,ChIJL4lQVUTVljMRFdQdEjH0Jls,https://www.google.com/maps/place/?q=place_id:ChIJL4lQVUTVljMRFdQdEjH0Jls
BDO ATM,ATM,OPERATIONAL,Lupao,Nueva Ecija,Central Luzon,"VVHX+7M7, Lupao, Nueva Ecija, Philippines",15.8781219,120.899192,,,ChIJi9ovN0vfkDMRWOj0vD8FjUA,https://www.google.com/maps/place/?q=place_id:ChIJi9ovN0vfkDMRWOj0vD8FjUA
BDO ATM,Bank,OPERATIONAL,Muñoz,Nueva Ecija,Central Luzon,"PW73+675, Muñoz-Lupao Rd, Muñoz, 3119 Nueva Ecija, Philippines",15.7130221,120.903289,,,ChIJBcH4wQTWkDMRP_embzidJVo,https://www.google.com/maps/place/?q=place_id:ChIJBcH4wQTWkDMRP_embzidJVo
Banco De Oro,Bank,OPERATIONAL,San Jose City,Nueva Ecija,Central Luzon,"QXVR+453, AH26, San Jose City, Nueva Ecija, Philippines",15.7927044,120.9904905,,,ChIJHydACB_akDMRUhmfztuqxRc,https://www.google.com/maps/place/?q=place_id:ChIJHydACB_akDMRUhmfztuqxRc
BDO,Bank,OPERATIONAL,San Jose City,Nueva Ecija,Central Luzon,"1, San Jose City, Nueva Ecija, Philippines",15.7890875,120.9820196,,,ChIJ7QedzPbZkDMRgp446q9SqOM,https://www.google.com/maps/place/?q=place_id:ChIJ7QedzPbZkDMRgp446q9SqOM
BDO Grass Residences Branch,Bank,OPERATIONAL,Quezon City,NCR,NCR,"Unit 101-102B, The Strip at Grass Residences Misamis St. corner Nueva Ecija and Nueva Vizcaya St, 3rd St, Quezon City, 1105 Metro Manila, Philippines",14.6591684,121.0289271,2.6,7,ChIJ6z6P16m3lzMR-gU8Nkqd7fc,https://www.google.com/maps/place/?q=place_id:ChIJ6z6P16m3lzMR-gU8Nkqd7fc
BDO Savemore Jaen Nueva Ecija ATM,ATM,OPERATIONAL,Jaen,Nueva Ecija,Central Luzon,"G/F Selling area of Savemore Supermarket, Brgy. G.E Antonio, Jaen, Nueva Ecija, Philippines",15.3391647,120.9115667,,,ChIJeQ710skhlzMRRodn_EajHE0,https://www.google.com/maps/place/?q=place_id:ChIJeQ710skhlzMRRodn_EajHE0
BDO Parañaque - San Antonio Valley 1 Branch,Bank,OPERATIONAL,Manila,NCR,NCR,"San Antonio Plaza, Blk 6 Lot 20 & 21, San Antonio Ave Brgy San Antonio Valley, 1 Dr Arcadio Santos Ave, Parañaque, Philippines",14.4671489,121.0203943,2.9,14,ChIJp3i8okXOlzMRnIuMUbB_F9Y,https://www.google.com/maps/place/?q=place_id:ChIJp3i8okXOlzMRnIuMUbB_F9Y
BDO Angeles City - Miranda Branch,ATM,OPERATIONAL,Angeles,Pampanga,Central Luzon,"BDO Bldg, Miranda St, Angeles, Pampanga, Philippines",15.137366,120.5897459,2.9,15,ChIJGTx1wEXyljMRW5MZUjDkDuo,https://www.google.com/maps/place/?q=place_id:ChIJGTx1wEXyljMRW5MZUjDkDuo
Banco de Oro,Bank,OPERATIONAL,Angeles,Pampanga,Central Luzon,"5H7R+CC4, MacArthur Hwy, Angeles, Pampanga, Philippines",15.1635003,120.5910717,2.6,27,ChIJZ2M1ZXbyljMRaRn0i5x5qMQ,https://www.google.com/maps/place/?q=place_id:ChIJZ2M1ZXbyljMRaRn0i5x5qMQ
"BDO, Angeles-Nepo Mart Branch",ATM,OPERATIONAL,Angeles,Pampanga,Central Luzon,"Entec Bldg., Teresa Avenue, Nepo Mart Complex Brgy, Angeles, Pampanga, Philippines",15.1329754,120.5865195,1.7,22,ChIJbV90Sk7yljMRch_XNNgTWhY,https://www.google.com/maps/place/?q=place_id:ChIJbV90Sk7yljMRch_XNNgTWhY
BDO Angeles - Marquee Mall,Bank,OPERATIONAL,Angeles,Pampanga,Central Luzon,"5J76+4C6, Angeles, Pampanga, Philippines",15.1627802,120.6110175,2,8,ChIJEYy4HwDzljMRhROZtd9lVNM,https://www.google.com/maps/place/?q=place_id:ChIJEYy4HwDzljMRhROZtd9lVNM
BDO Angeles-MacArthur Highway Branch ATM 1,Bank,OPERATIONAL,Angeles,Pampanga,Central Luzon,"Lot 1, MacArthur Highway, corner Magalang Ave, Angeles, Pampanga, Philippines",15.1485248,120.5939817,3.2,17,ChIJ998Rq2vyljMRfvjsJDLD35s,https://www.google.com/maps/place/?q=place_id:ChIJ998Rq2vyljMRfvjsJDLD35s
BDO Angeles-Friendship Highway Branch ATM 1,Bank,OPERATIONAL,Angeles,Pampanga,Central Luzon,"Ecco Building, Fil-Am Friendship Hwy, Angeles, Pampanga, Philippines",15.1603666,120.5563919,3.4,10,ChIJGVYHJsTzljMRNGqARARhiU8,https://www.google.com/maps/place/?q=place_id:ChIJGVYHJsTzljMRNGqARARhiU8
BDO Clark - Philexcel Business Park Branch,Bank,OPERATIONAL,Mabalacat City,Pampanga,Central Luzon,"Philexcel Business Park Manuel A. Roxas Highway, Zone, Clark Freeport, Angeles, Pampanga, Philippines",15.1727871,120.5368776,2.1,18,ChIJ5-5JCg3zljMRv6cfSIybDoQ,https://www.google.com/maps/place/?q=place_id:ChIJ5-5JCg3zljMRv6cfSIybDoQ
BDO Angeles - Friendship Highway,Bank,OPERATIONAL,Angeles,Pampanga,Central Luzon,"Brgy, Ecco Building, Fil-Am Friendship Hwy, Angeles, 2009 Pampanga, Philippines",15.1604571,120.5563431,,,ChIJs63BZc3zljMR0Q05xf7SCgI,https://www.google.com/maps/place/?q=place_id:ChIJs63BZc3zljMR0Q05xf7SCgI
BDO Angeles-Marquee Mall Branch ATM 3,ATM,OPERATIONAL,Angeles,Pampanga,Central Luzon,"Level 1, Space 1070, Marquee Mall, Angeles, Pampanga, Philippines",15.1627676,120.6109149,2.3,3,ChIJ2x9XxTLtljMRggKnC4JmvrQ,https://www.google.com/maps/place/?q=place_id:ChIJ2x9XxTLtljMRggKnC4JmvrQ
BDO Angeles-Balibago Branch ATM 1,ATM,OPERATIONAL,Angeles,Pampanga,Central Luzon,"BDO Building along Ramon Tang Avenue, Diamond Subd, Angeles, Pampanga, Philippines",15.1634658,120.5910818,5,1,ChIJV2k8ezXzljMReTMOuhKJ1Lg,https://www.google.com/maps/place/?q=place_id:ChIJV2k8ezXzljMReTMOuhKJ1Lg
BDO SM City Clark A Branch,Bank,OPERATIONAL,Mabalacat City,Pampanga,Central Luzon,"G/F SM City Clark Clark Field, Pampanga, Philippines",15.1680268,120.5818887,2.6,16,ChIJq9ytorDtljMRjZ5qjp6RMEk,https://www.google.com/maps/place/?q=place_id:ChIJq9ytorDtljMRjZ5qjp6RMEk
BDO SM City Clark B Branch,Bank,OPERATIONAL,Mabalacat City,Pampanga,Central Luzon,"G/F SM City Clark BPO Tower 1 & 2 (LC B1-101-107 Brgy, Pampanga, Philippines",15.1689713,120.5783395,2.8,17,ChIJFdiXMObzljMRFFXlIyUyTfE,https://www.google.com/maps/place/?q=place_id:ChIJFdiXMObzljMRFFXlIyUyTfE
BDO Angeles-Miranda Branch ATM 2,ATM,OPERATIONAL,Angeles,Pampanga,Central Luzon,"BDO Bldg, Miranda St, Angeles, Pampanga, Philippines",15.1373437,120.5897764,5,1,ChIJ4RReJnXzljMRZXuHMrGpV0Y,https://www.google.com/maps/place/?q=place_id:ChIJ4RReJnXzljMRZXuHMrGpV0Y
BDO Angeles-Nepo Mart Branch CDM,ATM,OPERATIONAL,Angeles,Pampanga,Central Luzon,"NTEC Bldg. Teresa Ave., Nepo Mart Complex, Brgy, Angeles, Pampanga, Philippines",15.1330617,120.5865682,,,ChIJQ_H3kgrzljMRNVPQBBE6VsA,https://www.google.com/maps/place/?q=place_id:ChIJQ_H3kgrzljMRNVPQBBE6VsA
BDO Angeles-MacArthur Highway Branch ATM 2,ATM,OPERATIONAL,Angeles,Pampanga,Central Luzon,"Lot 1, MacArthur Highway, corner Magalang Ave, Angeles, Pampanga, Philippines",15.1487538,120.5936485,,,ChIJRU9CCWvzljMRga7DjMjUcw4,https://www.google.com/maps/place/?q=place_id:ChIJRU9CCWvzljMRga7DjMjUcw4
BDO Clark Center,Bank,OPERATIONAL,Mabalacat City,Pampanga,Central Luzon,"5GGF+J5F, Clark Freeport, Mabalacat City, Pampanga, Philippines",15.1765722,120.5227802,1.5,11,ChIJXe-BZwCNljMRa0uFc9HJCIA,https://www.google.com/maps/place/?q=place_id:ChIJXe-BZwCNljMRa0uFc9HJCIA
BDO SM City Pampanga B Branch,Bank,OPERATIONAL,Mexico,Pampanga,Central Luzon,"G/F SM City Pampanga Annex Bldg, 4, San Fernando, Pampanga, Philippines",15.052148,120.7026245,2,27,ChIJnzTYlkT3ljMRVGnpi2netX0,https://www.google.com/maps/place/?q=place_id:ChIJnzTYlkT3ljMRVGnpi2netX0
BDO Angeles-Friendship Highway Branch ATM 2,ATM,OPERATIONAL,Angeles,Pampanga,Central Luzon,"ECCO Bldg., Fil-Am Friendship Highway Brgy, Angeles, Pampanga, Philippines",15.1604571,120.5563431,,,ChIJq3VH0TbzljMRj16IGdgSXwo,https://www.google.com/maps/place/?q=place_id:ChIJq3VH0TbzljMRj16IGdgSXwo
BDO SM City Telabastagan Mall Area 1 ATM,ATM,OPERATIONAL,San Fernando,Pampanga,Central Luzon,"G/F CDM 01 near mall entrance, MacArthur Hwy, San Fernando, Pampanga, Philippines",15.1203206,120.6018727,1.9,9,ChIJ7xvDwmbzljMRCvBAw26SgF8,https://www.google.com/maps/place/?q=place_id:ChIJ7xvDwmbzljMRCvBAw26SgF8
BDO Pampanga San Fernando - Dolores Branch,Bank,OPERATIONAL,San Fernando,Pampanga,Central Luzon,"2MJM+QRV, MacArthur Hwy, San Fernando, 2000 Pampanga, Philippines",15.0343569,120.6860963,3.9,15,ChIJa0HBfg73ljMR9uxCxljdzPE,https://www.google.com/maps/place/?q=place_id:ChIJa0HBfg73ljMR9uxCxljdzPE
BDO Pampanga San Fernando - McArthur Highway Branch,Bank,OPERATIONAL,San Fernando,Pampanga,Central Luzon,"Doña Isafel Bldg 2, Dolores, 2000, MacArthur Hwy, San Fernando, Pampanga, Philippines",15.0415015,120.6769473,1.8,9,ChIJf7NTmhr3ljMR9tYpcIy5vn4,https://www.google.com/maps/place/?q=place_id:ChIJf7NTmhr3ljMR9tYpcIy5vn4
BDO Waltermart - Pampanga Branch,Bank,OPERATIONAL,San Fernando,Pampanga,Central Luzon,"G/F Waltermart Pampanga, MacArthur Hwy, San Fernando, Pampanga, Philippines",15.0488643,120.6661887,3,26,ChIJ_-GukuH2ljMRk17hFvAMg68,https://www.google.com/maps/place/?q=place_id:ChIJ_-GukuH2ljMRk17hFvAMg68
BDO Pampanga San Fernando - Sindalan Branch,Bank,OPERATIONAL,San Fernando,Pampanga,Central Luzon,"Palm bldg, MacArthur Hwy, San Fernando, Pampanga, Philippines",15.0788194,120.6400739,3.5,11,ChIJy8P9oRtzkTMRsN7FH_1OhYQ,https://www.google.com/maps/place/?q=place_id:ChIJy8P9oRtzkTMRsN7FH_1OhYQ
BDO SM City San Fernando Branch,Bank,OPERATIONAL,San Fernando,Pampanga,Central Luzon,"SM, G/F, V. Tiomico St, San Fernando, Pampanga, Philippines",15.0279453,120.6920635,2.7,20,ChIJD7JRhUT3ljMR3Dcw2uHsH2M,https://www.google.com/maps/place/?q=place_id:ChIJD7JRhUT3ljMR3Dcw2uHsH2M
BDO Pampanga San Fernando - MacArthur Highway Branch,Bank,OPERATIONAL,San Fernando,Pampanga,Central Luzon,"G/F, Rodriguez Bldg, MacArthur Hwy, San Fernando, Pampanga, Philippines",15.0397241,120.6802715,,,ChIJC9sn_QlzkTMRSva-hlFUrYY,https://www.google.com/maps/place/?q=place_id:ChIJC9sn_QlzkTMRSva-hlFUrYY
BDO Pampanga San Fernando - San Isidro Branch,Bank,OPERATIONAL,San Fernando,Pampanga,Central Luzon,"Kingspire Business Center, MacArthur Hwy, San Fernando, Pampanga, Philippines",15.0586263,120.6569386,1.8,4,ChIJ4Sm1EnhzkTMR-AGNFP9_cT4,https://www.google.com/maps/place/?q=place_id:ChIJ4Sm1EnhzkTMR-AGNFP9_cT4
BDO SM City Pampanga Dept. Store Back Office ATM,ATM,OPERATIONAL,San Fernando,Pampanga,Central Luzon,"G/F, SM City Pampanga, Dept. Store, Jose Abad Santos Ave, San Fernando, Pampanga, Philippines",15.0525335,120.6988692,,,ChIJlWqMzlj3ljMRFxVH9qzPTig,https://www.google.com/maps/place/?q=place_id:ChIJlWqMzlj3ljMRFxVH9qzPTig
BDO ATM SM City Pampanga Mall Area 5,ATM,OPERATIONAL,San Fernando,Pampanga,Central Luzon,"G/F near Pizza Hut, SM City Pampanga Annex Brgy, San Fernando, Pampanga, Philippines",15.0520112,120.6989818,1,1,ChIJEzVVhUT3ljMRqEUa7pnLlac,https://www.google.com/maps/place/?q=place_id:ChIJEzVVhUT3ljMRqEUa7pnLlac
BDO Waltermart San Fernando Pampanga ATM,ATM,OPERATIONAL,San Fernando,Pampanga,Central Luzon,"G/F near activity area, Waltermart San Fernando MacArthur Highway, Brgy, San Fernando, Pampanga, Philippines",15.0480879,120.6659204,4,1,ChIJ53FmFlb3ljMReYUS61U1Qjw,https://www.google.com/maps/place/?q=place_id:ChIJ53FmFlb3ljMReYUS61U1Qjw
"One Network, A Rural Bank Of BDO",Bank,OPERATIONAL,San Fernando,Pampanga,Central Luzon,"3rd floor BDO Mc Arthur Hiway Branch, Doña Isafel Bldg 2, San Fernando, Pampanga, Philippines",15.0412591,120.6773032,,,ChIJk6M-eBf3ljMRCBXRCWQ9F6Y,https://www.google.com/maps/place/?q=place_id:ChIJk6M-eBf3ljMRCBXRCWQ9F6Y
BDO Network Bank - Arayat Branch,Bank,OPERATIONAL,Arayat,Pampanga,Central Luzon,"4QXC+V5C, J.M. Espino, Arayat, Pampanga, Philippines",15.1496804,120.7703848,2.2,5,ChIJoTjcAXTlljMRlwpRBPJAUOI,https://www.google.com/maps/place/?q=place_id:ChIJoTjcAXTlljMRlwpRBPJAUOI
BDO Pampanga- Guagua Town Center Branch,Bank,OPERATIONAL,Guagua,Pampanga,Central Luzon,"GTC Building, Lot 2, Olongapo-Gapan &, Provincial Road, Brgy, Guagua, Pampanga, Philippines",14.9869951,120.6286186,3,2,ChIJP47JQGhZljMR55FFrSdd70c,https://www.google.com/maps/place/?q=place_id:ChIJP47JQGhZljMR55FFrSdd70c
BDO Guagua Town Center,Bank,OPERATIONAL,Guagua,Pampanga,Central Luzon,"XJMC+PQG, Guagua, Pampanga, Philippines",14.984313,120.6219378,3.5,11,ChIJIza2rpJZljMRkhqEATmdZkw,https://www.google.com/maps/place/?q=place_id:ChIJIza2rpJZljMRkhqEATmdZkw
BDO Guagua Plaza,Bank,OPERATIONAL,Guagua,Pampanga,Central Luzon,"XJ8M+46G, Guagua, Pampanga, Philippines",14.9653152,120.6330894,2.6,8,ChIJnau4v91fljMRRGWbu1gtYG4,https://www.google.com/maps/place/?q=place_id:ChIJnau4v91fljMRRGWbu1gtYG4
BDO Network Bank,Bank,OPERATIONAL,Floridablanca,Pampanga,Central Luzon,"XGFG+VF5, Macabulos, Floridablanca, Pampanga, Philippines",14.9746425,120.5262205,,,ChIJfwKlwXhgljMRPYYo6aK2sA8,https://www.google.com/maps/place/?q=place_id:ChIJfwKlwXhgljMRPYYo6aK2sA8
BDO Pampanga-Lubao,Bank,OPERATIONAL,Lubao,Pampanga,Central Luzon,"Jose Abad Santos Ave, Lubao, Pampanga, Philippines",14.9135484,120.5675381,2.8,10,ChIJTfaPZdFdljMROg7JIrUY7z4,https://www.google.com/maps/place/?q=place_id:ChIJTfaPZdFdljMROg7JIrUY7z4
BDO SM Hypermarket Mabalacat,Bank,OPERATIONAL,Mabalacat City,Pampanga,Central Luzon,"508 MacArthur Hwy, Mabalacat City, 2010 Pampanga, Philippines",15.1925293,120.5824827,2.3,34,ChIJWbbVp6PtljMRi0ZQCHCyPaw,https://www.google.com/maps/place/?q=place_id:ChIJWbbVp6PtljMRi0ZQCHCyPaw
BDO- Mabalacat Puregold Dau,Bank,OPERATIONAL,Mabalacat City,Pampanga,Central Luzon,"Mabalacat City, Pampanga, Philippines",15.1747581,120.588233,1,5,ChIJyaHGAo_tljMRwMBu-4Yps-U,https://www.google.com/maps/place/?q=place_id:ChIJyaHGAo_tljMRwMBu-4Yps-U
BDO Puregold Dau ATM,ATM,OPERATIONAL,Mabalacat City,Pampanga,Central Luzon,"G/F Cosco Bldg, MacArthur Hwy, Mabalacat City, Pampanga, Philippines",15.1747356,120.5881544,1.9,11,ChIJv3vnbRVzkTMR8vxlCJwZIJY,https://www.google.com/maps/place/?q=place_id:ChIJv3vnbRVzkTMR8vxlCJwZIJY
BDO,ATM,OPERATIONAL,Mabalacat City,Pampanga,Central Luzon,"SM Hypermarket, 508 MacArthur Hwy, Mabalacat City, 2010 Pampanga, Philippines",15.1924215,120.5824901,4,1,ChIJjaxYqKPtljMR72qo24lgaPI,https://www.google.com/maps/place/?q=place_id:ChIJjaxYqKPtljMR72qo24lgaPI
