Branch Name,Types,Business Status,City,Province,Region,Address,Latitude,Longitude,Rating,User Ratings Count,Place ID,Google Maps Link
Bdo Network Bank,Bank,OPERATIONAL,Ligao City,Albay,Bicol Region,"6GPX+WHV, Albay West Coast Road, Ligao City, Albay, Philippines",13.2373807,123.5489096,1,2,ChIJLya9XeoJoTMR_N3l2LDiIgU,https://www.google.com/maps/place/?q=place_id:ChIJLya9XeoJoTMR_N3l2LDiIgU
BDO Network Bank,Bank,OPERATIONAL,Tabaco City,Albay,Bicol Region,"9P4H+WC9, A. A. Berces St, Tabaco City, Albay, Philippines",13.3572866,123.7286212,,,ChIJQ4-gD8itoTMRrGuyUb9XWd8,https://www.google.com/maps/place/?q=place_id:ChIJQ4-gD8itoTMRrGuyUb9XWd8
Xoom Money Transfer - Banco de Oro / EPCI Albay-Tabaco,Bank,OPERATIONAL,Tabaco City,Albay,Bicol Region,"Tabaco City, Albay, Philippines",13.356936,123.729977,,,ChIJSeLS-retoTMRRIkjQD8I1GI,https://www.google.com/maps/place/?q=place_id:ChIJSeLS-retoTMRRIkjQD8I1GI
BDO Savemore Bacacay ATM,ATM,OPERATIONAL,Bacacay,Albay,Bicol Region,"Beside tenant and dining area, Poblacion, Barangay, 5, Bacacay, Albay, Philippines",13.293925,123.7924196,5,1,ChIJKYIsAISroTMRrEsP313OhMk,https://www.google.com/maps/place/?q=place_id:ChIJKYIsAISroTMRrEsP313OhMk
BDO Network Bank,Bank,OPERATIONAL,Camalig,Albay,Bicol Region,"5MJ4+QC2, Poblacion, Camalig, Albay, Philippines",13.1818838,123.6560333,1,1,ChIJJ84KNR8HoTMRTE8xzPWyCmw,https://www.google.com/maps/place/?q=place_id:ChIJJ84KNR8HoTMRTE8xzPWyCmw
BDO Albay-Daraga Branch ATM 1,Bank,OPERATIONAL,Daraga,Albay,Bicol Region,"4PX7+37V, Rizal St., corner Burgos St Brgy Centro, M.H. Del Pilar Street, Daraga, Albay, Philippines",13.1480802,123.7127535,2.1,15,ChIJdfOA1v0DoTMRbS7e99cVruY,https://www.google.com/maps/place/?q=place_id:ChIJdfOA1v0DoTMRbS7e99cVruY
BDO Albay - Daraga,Bank,OPERATIONAL,Daraga,Albay,Bicol Region,"Rizal St., Corner P. Burgos St Brgy Centro, Daraga, 4501 Albay, Philippines",13.1480828,123.7128455,,,ChIJZVPGVLEDoTMRRI37cTO9nLU,https://www.google.com/maps/place/?q=place_id:ChIJZVPGVLEDoTMRRI37cTO9nLU
BDO Albay - Polangui Branch,Bank,OPERATIONAL,Polangui,Albay,Bicol Region,"Provincial Road cor. Brgy. Road., Brgy, Polangui, Albay, Philippines",13.28929,123.4904449,3.1,8,ChIJjX6-1D2YoTMRcU1V7l5D6Ck,https://www.google.com/maps/place/?q=place_id:ChIJjX6-1D2YoTMRcU1V7l5D6Ck
BDO PGPC Tiwi,ATM,OPERATIONAL,Tiwi,Albay,Bicol Region,"G/F inside Tiwi Center, Tiwi, Albay, Philippines",13.4612024,123.6399562,,,ChIJk5T6KXKxoTMRe3HvWJKq-Fg,https://www.google.com/maps/place/?q=place_id:ChIJk5T6KXKxoTMRe3HvWJKq-Fg
BDO AP Renewables-Tiwi,ATM,OPERATIONAL,Tiwi,Albay,Bicol Region,"G/F Lobby Area, Brgy. Naga, Tiwi, Albay, Philippines",13.4612024,123.6399562,,,ChIJhQ1pdTexoTMRHmIq2tYBH_w,https://www.google.com/maps/place/?q=place_id:ChIJhQ1pdTexoTMRHmIq2tYBH_w
BDO Camarines Norte - Daet Branch,Bank,OPERATIONAL,Daet,Camarines Norte,Bicol Region,"J. Lukban St, corner Moreno St, Daet, Camarines Norte, Philippines",14.1155692,122.954959,3.8,18,ChIJ1aNO6PmumDMRsKrtzNeE514,https://www.google.com/maps/place/?q=place_id:ChIJ1aNO6PmumDMRsKrtzNeE514
BDO SM Hypermarket Daet Branch,Bank,OPERATIONAL,Daet,Camarines Norte,Bicol Region,"SM Hypermarket, G/F, Vinzons Ave, Daet, Camarines Norte, Philippines",14.117188,122.9530811,3,4,ChIJf4zoR8evmDMRUh20FHyRMKM,https://www.google.com/maps/place/?q=place_id:ChIJf4zoR8evmDMRUh20FHyRMKM
BDO,Bank,OPERATIONAL,Daet,Camarines Norte,Bicol Region,"Ground Floor, SM City, Daet, Camarines Norte, Philippines",14.1208008,122.9454994,5,1,ChIJYSRfr76vmDMR_OhEia8KguU,https://www.google.com/maps/place/?q=place_id:ChIJYSRfr76vmDMR_OhEia8KguU
BDO,Bank,OPERATIONAL,Daet,Camarines Norte,Bicol Region,"4X94+FF2, Bagasbas Road, Daet, 4600 Camarines Norte, Philippines",14.1186329,122.9561457,,,ChIJgSqFvlqumDMRhf_A0XWCPm8,https://www.google.com/maps/place/?q=place_id:ChIJgSqFvlqumDMRhf_A0XWCPm8
BDO Camarines Sur - Calabanga,Bank,OPERATIONAL,Calabanga,Camarines Sur,Bicol Region,"Galleria de Calabanga, Lot 2 Provincial Road, San Francisco (Pob, Calabanga, 4405 Camarines Sur, Philippines",13.7076888,123.2148747,4.2,5,ChIJlZoaqGD1oTMRNmP8dQvSU_M,https://www.google.com/maps/place/?q=place_id:ChIJlZoaqGD1oTMRNmP8dQvSU_M
Bdo Network Bank,Bank,OPERATIONAL,Jose Panganiban,Camarines Norte,Bicol Region,"Jose Panganiban, Camarines Norte, Philippines",14.2866568,122.6954254,1,1,ChIJO1M6AMKVmDMRFbYBD6HVEG0,https://www.google.com/maps/place/?q=place_id:ChIJO1M6AMKVmDMRFbYBD6HVEG0
BDO Naga - Panganiban Drive Branch,Bank,OPERATIONAL,Naga City,Camarines Sur,Bicol Region,"G/F DECA Corporate Center, Panganiban Dr, Naga City, Camarines Sur, Philippines",13.6222283,123.1939705,1.8,5,ChIJgYeqocmMoTMRXZPu3rnqM7g,https://www.google.com/maps/place/?q=place_id:ChIJgYeqocmMoTMRXZPu3rnqM7g
BDO Naga - Plaza Rizal Branch,Bank,OPERATIONAL,Naga City,Camarines Sur,Bicol Region,"Gen. Luna, St, Naga City, 4400 Camarines Sur, Philippines",13.6235264,123.1844774,3.4,9,ChIJWWj6IrGMoTMRNxKgaavhKgU,https://www.google.com/maps/place/?q=place_id:ChIJWWj6IrGMoTMRNxKgaavhKgU
BDO SM City Daet Dept. Store Customer Service ATM,ATM,OPERATIONAL,Daet,Camarines Norte,Bicol Region,"GF, SM City Daet Department Store Customer Service Area Vinzons Avenue, Brgy, Daet, Camarines Norte, Philippines",14.1211346,122.9451894,,,ChIJO6w3hl-vmDMRtPecw9Kyr04,https://www.google.com/maps/place/?q=place_id:ChIJO6w3hl-vmDMRtPecw9Kyr04
BDO SM City Daet Mall Area 1 ATM,ATM,OPERATIONAL,Daet,Camarines Norte,Bicol Region,"2F, SM City Daet, Vinzons Avenue, Brgy, Daet, Camarines Norte, Philippines",14.121127,122.9459663,,,ChIJ04F_kAGvmDMR_SgRrXLxkV0,https://www.google.com/maps/place/?q=place_id:ChIJ04F_kAGvmDMR_SgRrXLxkV0
BDO Naga - Elias Angeles Branch,Bank,OPERATIONAL,Naga City,Camarines Sur,Bicol Region,"Chua - Oco Bldg, Elias Angeles, Naga City, Camarines Sur, Philippines",13.6260082,123.1865999,3,7,ChIJT9svbbSMoTMR80iM0t4IoZY,https://www.google.com/maps/place/?q=place_id:ChIJT9svbbSMoTMR80iM0t4IoZY
BDO SM City Daet ATM Center,ATM,OPERATIONAL,Daet,Camarines Norte,Bicol Region,"GF, SM City Daet, Vinzons Avenue, Brgy, Daet, Camarines Norte, Philippines",14.1216236,122.9459297,,,ChIJ8Xf5vUevmDMRzHR-714DwYs,https://www.google.com/maps/place/?q=place_id:ChIJ8Xf5vUevmDMRzHR-714DwYs
BDO Naga - Magsaysay Avenue Branch,Bank,OPERATIONAL,Naga City,Camarines Sur,Bicol Region,"One Magsaysay Bldg., Magsaysay Avenue, corner Reno St, Brgy, Naga City, Camarines Sur, Philippines",13.621741,123.2011729,3.8,12,ChIJtZDfZDTzoTMRPVcI-DtV5JY,https://www.google.com/maps/place/?q=place_id:ChIJtZDfZDTzoTMRPVcI-DtV5JY
BDO SM City Daet Dept. Store Back Office ATM,ATM,OPERATIONAL,Daet,Camarines Norte,Bicol Region,"2F, SM City Daet Department Store Back Office Vinzons Avenue, Brgy, Daet, Camarines Norte, Philippines",14.1214884,122.9451894,,,ChIJ0Zd217CvmDMRtj1It6WB23k,https://www.google.com/maps/place/?q=place_id:ChIJ0Zd217CvmDMRtj1It6WB23k
BDO SM City Naga Branch,Bank,OPERATIONAL,Naga City,Camarines Sur,Bicol Region,"G/F SM City Naga, Barangay Triangulo Central Business District II, Naga City, Camarines Sur, Philippines",13.6218166,123.1902402,1.8,4,ChIJ_2VGsLSNoTMRZ4awzGn6KIM,https://www.google.com/maps/place/?q=place_id:ChIJ_2VGsLSNoTMRZ4awzGn6KIM
BDO Naga - Diversion,Bank,OPERATIONAL,Naga City,Camarines Sur,Bicol Region,"Building 5, Stalls A and B, M. Plaza Roxas Avenue, Diversion Road, Naga City, Camarines Sur, Philippines",13.6164219,123.1952463,3.5,8,ChIJ5TiTWgKNoTMRaeso3XfCvmU,https://www.google.com/maps/place/?q=place_id:ChIJ5TiTWgKNoTMRaeso3XfCvmU
BDO Naga – Concepcion,Bank,OPERATIONAL,Naga City,Camarines Sur,Bicol Region,"J6C7+QXR, 1, Naga City, Camarines Sur, Philippines",13.6219198,123.2149141,4,11,ChIJgWR-ayqNoTMRPv4atYzCFxY,https://www.google.com/maps/place/?q=place_id:ChIJgWR-ayqNoTMRPv4atYzCFxY
BDO Network Bank - Naga,Bank,OPERATIONAL,Naga City,Camarines Sur,Bicol Region,"Romar Building II, Dinaga Street., Corner Elias Angeles St, Brgy. Dinaga, Naga City, 4400 Camarines Sur, Philippines",13.6215361,123.1855337,,,ChIJqyONk1eNoTMRTPP6NcL2AQA,https://www.google.com/maps/place/?q=place_id:ChIJqyONk1eNoTMRTPP6NcL2AQA
BDO Iriga City Branch,Bank,OPERATIONAL,Iriga City,Camarines Sur,Bicol Region,"Iriga Plaza Hotel Msgr. Lanuza St. San Francisco, Iriga City, Camarines Sur, Philippines",13.4200666,123.411866,4.3,15,ChIJ_XDf7D6YoTMRI4GFbDZZMHg,https://www.google.com/maps/place/?q=place_id:ChIJ_XDf7D6YoTMRI4GFbDZZMHg
BDO Iriga City - Puregold Branch,Bank,OPERATIONAL,Iriga City,Camarines Sur,Bicol Region,"Southbound Rd, Iriga City, Camarines Sur, Philippines",13.4214177,123.4123686,3.8,4,ChIJReg0oQOZoTMR3Ssa0UC_EPg,https://www.google.com/maps/place/?q=place_id:ChIJReg0oQOZoTMR3Ssa0UC_EPg
BDO Network Bank,Bank,OPERATIONAL,Baao,Camarines Sur,Bicol Region,"F947+WRJ, Baao, Camarines Sur, Philippines",13.4573346,123.3645086,,,ChIJPeMOjmqXoTMRY0DRr_HWnJo,https://www.google.com/maps/place/?q=place_id:ChIJPeMOjmqXoTMRY0DRr_HWnJo
BDO Camarines Sur - Pili,Bank,OPERATIONAL,Pili,Camarines Sur,Bicol Region,"Santiago, Pili, Camarines Sur, Philippines",13.553001,123.2762133,4.8,6,ChIJiZ-07yaToTMRmwsUjCUe9qA,https://www.google.com/maps/place/?q=place_id:ChIJiZ-07yaToTMRmwsUjCUe9qA
BDO Network Bank Camarines Sur - Tigaon,Bank,OPERATIONAL,Tigaon,Camarines Sur,Bicol Region,"G/F, Lim Bldg, Real St, Poblacion, Tigaon, Camarines Sur, Philippines",13.6320503,123.4979242,5,3,ChIJ8U11LpfBoTMR6h35S0O2xYg,https://www.google.com/maps/place/?q=place_id:ChIJ8U11LpfBoTMR6h35S0O2xYg
BDO Naga - Tabuco,Bank,OPERATIONAL,Naga City,Camarines Sur,Bicol Region,"G/F, BRDC Building, Biak na Bato, Brgy. Tabuco, Naga City, 4400 Camarines Sur, Philippines",13.6191875,123.1836,,,ChIJ060JJQWNoTMRmAj1EUPvnQ0,https://www.google.com/maps/place/?q=place_id:ChIJ060JJQWNoTMRmAj1EUPvnQ0
BDO,Bank,OPERATIONAL,Bato,Camarines Sur,Bicol Region,"241 Poblacion Rd, Poblacion, Bato, Camarines Sur, Philippines",13.3564093,123.3652452,,,ChIJCTG9f8qfoTMRag-tmKSGNsQ,https://www.google.com/maps/place/?q=place_id:ChIJCTG9f8qfoTMRag-tmKSGNsQ
BDO Camarines Sur - Goa,Bank,OPERATIONAL,Goa,Camarines Sur,Bicol Region,"Gov Jose T. Fuentebella National Hwy, Goa, Camarines Sur, Philippines",13.6975109,123.4891302,3.3,3,ChIJZ_cgcEDDoTMRZOtCM4CR8q0,https://www.google.com/maps/place/?q=place_id:ChIJZ_cgcEDDoTMRZOtCM4CR8q0
BDO Camarines Sur - Milaor Branch,Bank,OPERATIONAL,Milaor,Camarines Sur,Bicol Region,"J52H+89Q, Milaor, Camarines Sur, Philippines",13.6008798,123.1785043,,,ChIJTygkSCeNoTMRREwJGVPkIeo,https://www.google.com/maps/place/?q=place_id:ChIJTygkSCeNoTMRREwJGVPkIeo
BDO Virac Town Center Branch,Bank,OPERATIONAL,Virac,Catanduanes,Bicol Region,"G/F Virac Town Center, Rizal Avenue, Brgy, Virac, 4800 Catanduanes, Philippines",13.5793543,124.2284213,3.9,19,ChIJfdOJV8UWoDMRy78hAkFLVO4,https://www.google.com/maps/place/?q=place_id:ChIJfdOJV8UWoDMRy78hAkFLVO4
BDO - Tinambac,Bank,OPERATIONAL,Tinambac,Camarines Sur,Bicol Region,"R88G+8F5, Tinambac, Camarines Sur, Philippines",13.8157599,123.3262458,4.7,3,ChIJv5BtllvloTMRBef-_aT5bAo,https://www.google.com/maps/place/?q=place_id:ChIJv5BtllvloTMRBef-_aT5bAo
BDO ATM,ATM,OPERATIONAL,Nabua,Camarines Sur,Bicol Region,"C95F+94M, Nabua, Camarines Sur, Philippines",13.4084658,123.3727946,4,3,ChIJY4p3WaKZoTMRg1AyPfSqq8E,https://www.google.com/maps/place/?q=place_id:ChIJY4p3WaKZoTMRg1AyPfSqq8E
BDO Las Piñas - Pamplona Tres Branch,Bank,OPERATIONAL,Las Piñas,NCR,NCR,"Unit 101-104, G/F, Lot G & H Torre Sur, Alabang Zapote Brgy, Las Piñas, Metro Manila, Philippines",14.4486498,120.9843317,3,26,ChIJ3bK1hB_RlzMRXRch6szPh_A,https://www.google.com/maps/place/?q=place_id:ChIJ3bK1hB_RlzMRXRch6szPh_A
BDO Network Bank,ATM,OPERATIONAL,Ragay,Camarines Sur,Bicol Region,"RQ9R+76F, Ragay, Camarines Sur, Philippines",13.818214,122.7905259,4.3,6,ChIJ-beDKgATojMRcnhRIfTYGuI,https://www.google.com/maps/place/?q=place_id:ChIJ-beDKgATojMRcnhRIfTYGuI
BDO Binondo - San Fernando Branch,Bank,OPERATIONAL,Manila,NCR,NCR,"Units 1-6, G/F, 500 San Fernando St 026, San Nicolas, Philippines",14.5991815,120.972891,2.5,4,ChIJs7NCOe7LlzMR6uma1kHKkbM,https://www.google.com/maps/place/?q=place_id:ChIJs7NCOe7LlzMR6uma1kHKkbM
BDO Catanduanes - Virac Branch,Bank,OPERATIONAL,Virac,Catanduanes,Bicol Region,"Brgy, Rizal Ave, Virac, Catanduanes, Philippines",13.5840634,124.2343648,4.3,3,ChIJxVOCy9UXoDMR5pr_cx8PieM,https://www.google.com/maps/place/?q=place_id:ChIJxVOCy9UXoDMR5pr_cx8PieM
BDO Sorsogon - Primark J.P. Rizal Branch,Bank,OPERATIONAL,Sorsogon City,Sorsogon,Bicol Region,"Primark Sorsogon 3, J.P. Rizal St, corner De Vera St, Sorsogon City, Philippines",12.9700442,124.0049008,4.7,6,ChIJKRd8QXXvoDMRO88UvnygN0Y,https://www.google.com/maps/place/?q=place_id:ChIJKRd8QXXvoDMRO88UvnygN0Y
BDO Kamagong Branch,Bank,OPERATIONAL,Manila,NCR,NCR,"Extension) corner, 2567 P. Ocampo Vito Cruz, 2568 Madre Perla, San Andres Bukid, Manila, 1017 Metro Manila, Philippines",14.5670545,121.0038802,2.8,12,ChIJ_yhs6Z3JlzMRoj9soMeYr3s,https://www.google.com/maps/place/?q=place_id:ChIJ_yhs6Z3JlzMRoj9soMeYr3s
BDO Masbate Branch,Bank,OPERATIONAL,Masbate City,Masbate,Bicol Region,"44 Quezon St, Masbate City, 5400 Masbate, Philippines",12.3684989,123.6196127,4.6,9,ChIJC78bblXbpjMRKsBwhFZoUC4,https://www.google.com/maps/place/?q=place_id:ChIJC78bblXbpjMRKsBwhFZoUC4
BDO Masbate-F. Magallanes,Bank,OPERATIONAL,Masbate City,Masbate,Bicol Region,"178 Quezon St, Masbate City, 5400 Masbate, Philippines",12.363481,123.6254239,5,8,ChIJ-YWXjtDdpjMRVGV0sqEj5pk,https://www.google.com/maps/place/?q=place_id:ChIJ-YWXjtDdpjMRVGV0sqEj5pk
BDO Network Bank,ATM,OPERATIONAL,Aroroy,Masbate,Bicol Region,"G96W+QMP, Aroroy, Masbate, Philippines",12.51197,123.3967288,1,1,ChIJIZkX31-3pjMRZmtFkejZ920,https://www.google.com/maps/place/?q=place_id:ChIJIZkX31-3pjMRZmtFkejZ920
BDO ATM,ATM,OPERATIONAL,Masbate City,Masbate,Bicol Region,"44 Quezon St, Masbate City, 5400 Masbate, Philippines",12.3685573,123.6196546,,,ChIJTxACblXbpjMRtv6jQj_TqIo,https://www.google.com/maps/place/?q=place_id:ChIJTxACblXbpjMRtv6jQj_TqIo
BDO SM Center Las Piñas,Bank,OPERATIONAL,Las Piñas,NCR,NCR,"LGF SM Center, Alabang–Zapote Rd, Las Piñas, Metro Manila, Philippines",14.4496196,120.9802547,2.4,31,ChIJlfG5PvnNlzMREYGQVWetYuc,https://www.google.com/maps/place/?q=place_id:ChIJlfG5PvnNlzMREYGQVWetYuc
BDO Sorsogon City Branch,Bank,OPERATIONAL,Sorsogon City,Sorsogon,Bicol Region,"X2C5+R2P, GF St. Matthew's Bldg., Magsaysay St, Brgy Almendras St, Sorsogon City, Sorsogon, Philippines",12.973608,124.0080001,2.6,9,ChIJ0TeLQqnvoDMR2b2OeFRHfPU,https://www.google.com/maps/place/?q=place_id:ChIJ0TeLQqnvoDMR2b2OeFRHfPU
BDO SM City Sorsogon,Bank,OPERATIONAL,Sorsogon City,Sorsogon,Bicol Region,"G/F, SM City, Maharlika Hwy, East District, Sorsogon City, 4700 Sorsogon, Philippines",12.9758398,124.0191294,,,ChIJxQvK_srvoDMRj9yrAyjfSqI,https://www.google.com/maps/place/?q=place_id:ChIJxQvK_srvoDMRj9yrAyjfSqI
BDO NETWORK BANK,Bank,OPERATIONAL,Bulan,Sorsogon,Bicol Region,"4706 C. Gotladera St, corner N. Roque Street, Bulan, 4706 Sorsogon, Philippines",12.6675928,123.8745609,,,ChIJaV3ycQDXoDMRtnqrpCq43JQ,https://www.google.com/maps/place/?q=place_id:ChIJaV3ycQDXoDMRtnqrpCq43JQ
BDO Network Bank,Bank,OPERATIONAL,Gubat,Sorsogon,Bicol Region,"W4CF+94C, Gubat, Sorsogon, Philippines",12.9209333,124.1227587,4,1,ChIJQQ8nPQDroDMRvGj1Tgg565k,https://www.google.com/maps/place/?q=place_id:ChIJQQ8nPQDroDMRvGj1Tgg565k
BDO SM City Sorsogon Mall Area 1 ATM,ATM,OPERATIONAL,Sorsogon City,Sorsogon,Bicol Region,"near Food Court, SM City, 2/F 01 1, Sorsogon City, 4700 Sorsogon, Philippines",12.976239,124.018721,5,2,ChIJg39pHMvvoDMRoddlJiEwdFQ,https://www.google.com/maps/place/?q=place_id:ChIJg39pHMvvoDMRoddlJiEwdFQ
BDO SM City Sorsogon Dept. Store Selling Area 1 ATM,ATM,OPERATIONAL,Sorsogon City,Sorsogon,Bicol Region,"G/F , Department Store, SM City, 1, Sorsogon City, 4700 Sorsogon, Philippines",12.9753588,124.0468241,,,ChIJJ8sO4jjvoDMRPMASo78uWi0,https://www.google.com/maps/place/?q=place_id:ChIJJ8sO4jjvoDMRPMASo78uWi0
BDO Pasig - The Grove Rockwell Branch,Bank,OPERATIONAL,Pasig,NCR,NCR,"G/F The Grove by Rockwell, 117 Eulogio Rodriguez Jr. Ave, Pasig, Metro Manila, Philippines",14.586272,121.0812561,5,3,ChIJKc2_SnTHlzMRe9k27Ajo0cY,https://www.google.com/maps/place/?q=place_id:ChIJKc2_SnTHlzMRe9k27Ajo0cY
BDO Network Bank,Bank,OPERATIONAL,Donsol,Sorsogon,Bicol Region,"WH4V+CM6, Clemente St, Donsol, Sorsogon, Philippines",12.9060177,123.5941639,3,2,ChIJH0JecRU9oTMRwlxPc686CIM,https://www.google.com/maps/place/?q=place_id:ChIJH0JecRU9oTMRwlxPc686CIM
BDO Unibank,Bank,OPERATIONAL,Gubat,Sorsogon,Bicol Region,"W4CF+C35, Junction Abuyog - Gubat - Ariman Rd, Gubat, Sorsogon, Philippines",12.9209382,124.1227449,,,ChIJO0saFQDroDMR-pKuIGUpPV0,https://www.google.com/maps/place/?q=place_id:ChIJO0saFQDroDMR-pKuIGUpPV0
BDO,Bank,OPERATIONAL,Irosin,Sorsogon,Bicol Region,"P23J+QGV, M.L. Quezon St, Irosin, Sorsogon, Philippines",12.7044925,124.0312838,,,ChIJxf-3t2LPoDMRLkatndaTkhE,https://www.google.com/maps/place/?q=place_id:ChIJxf-3t2LPoDMRLkatndaTkhE
BDO Southgate Mall - EDSA Branch,Bank,OPERATIONAL,Makati City,NCR,NCR,"G/F Southgate Mall, EDSA corner, Chino Roces Ave, Makati, Kalakhang Maynila, Philippines",14.5411387,121.0189564,3,7,ChIJByvlqz3JlzMR31Qswk4as_8,https://www.google.com/maps/place/?q=place_id:ChIJByvlqz3JlzMR31Qswk4as_8
BDO San Pablo - Maharlika Highway Branch,Bank,OPERATIONAL,Matnog,Sorsogon,Bicol Region,"G/F BienPaz Arcade, Maharlika Highway Kunction, San Rafael, Asian Highway, Lungsod ng San Pablo, Laguna, Philippines",12.6679167,123.9881642,,,ChIJG2m_iQvPoDMRscQ1Z1EVg1g,https://www.google.com/maps/place/?q=place_id:ChIJG2m_iQvPoDMRscQ1Z1EVg1g
BDO Abra-Bangued Branch ATM 2,ATM,OPERATIONAL,Bangued,Abra,Cordillera Administrative Region,"Unit 12, The Rosario Bldg Taft St. corner, Magallanes St, Bangued, 2800 Abra, Philippines",17.5952713,120.618455,5,1,ChIJ18r9R_1djjMRDVoLfMs_fXU,https://www.google.com/maps/place/?q=place_id:ChIJ18r9R_1djjMRDVoLfMs_fXU
Banco De Oro,Bank,OPERATIONAL,Bangued,Abra,Cordillera Administrative Region,"HJW9+387, Taft Ave, Bangued, Abra, Philippines",17.595162,120.6182981,,,ChIJWRwRNwdcjjMRwlIpC4HPorQ,https://www.google.com/maps/place/?q=place_id:ChIJWRwRNwdcjjMRwlIpC4HPorQ
BDO Network Bank,Bank,OPERATIONAL,Tayum,Abra,Cordillera Administrative Region,"JM73+F4R, Abra - Kalinga Rd, Tayum, Abra, Philippines",17.6137505,120.6527542,,,ChIJUyE-Cm1ZjjMRtsL0DNaJT1o,https://www.google.com/maps/place/?q=place_id:ChIJUyE-Cm1ZjjMRtsL0DNaJT1o
BDO Pasig - Maybunga Branch,Bank,OPERATIONAL,Pasig,NCR,NCR,"Bldg 3 Blk 1, G/F Armal, Lot 1-3 C. Raymundo Ave, Pasig, Metro Manila, Philippines",14.5757603,121.0846607,3.1,13,ChIJ58CkLX3HlzMRFncBMv_mCaM,https://www.google.com/maps/place/?q=place_id:ChIJ58CkLX3HlzMRFncBMv_mCaM
BDO Pasig - Puregold San Joaquin Branch,Bank,OPERATIONAL,Pasig,NCR,NCR,"G/F Puregold, 165 M. Concepcion Ave, Pasig, 1600 Metro Manila, Philippines",14.553653,121.0719159,1.4,36,ChIJ_zoNWJHJlzMRUOEINZcstnE,https://www.google.com/maps/place/?q=place_id:ChIJ_zoNWJHJlzMRUOEINZcstnE
BDO SM City Baguio Branch,Bank,OPERATIONAL,Baguio,Benguet,Cordillera Administrative Region,"UG/F SM City Baguio, Upper Session Rd, Baguio, Philippines",16.4087866,120.599274,1.4,53,ChIJyaHXPYKhkTMRTTsVMKlxEJI,https://www.google.com/maps/place/?q=place_id:ChIJyaHXPYKhkTMRTTsVMKlxEJI
BDO Baguio - Legarda Branch,Bank,OPERATIONAL,Baguio,Benguet,Cordillera Administrative Region,"Our Lady of Fatima Bldg, Yandoc St, Baguio, Benguet, Philippines",16.412796,120.5905911,3.4,30,ChIJ-yHoT2-hkTMR3iDGCjwd3qc,https://www.google.com/maps/place/?q=place_id:ChIJ-yHoT2-hkTMR3iDGCjwd3qc
BDO Baguio - Session Road Branch,Bank,OPERATIONAL,Baguio,Benguet,Cordillera Administrative Region,"National Life Insurance Company Bldg., G/F, Session Rd, Baguio, 2600 Benguet, Philippines",16.4117358,120.5982374,1.7,15,ChIJZ6QLt0KhkTMRULxkyrLubPo,https://www.google.com/maps/place/?q=place_id:ChIJZ6QLt0KhkTMRULxkyrLubPo
"BDO Unibank, Inc.",Bank,OPERATIONAL,Baguio,Benguet,Cordillera Administrative Region,"G/F Our Lady of Lourdes Bldg., No. 7 Harrison Rd Brgy, Baguio, Benguet, Philippines",16.4129198,120.5954749,2.3,20,ChIJQTko3GehkTMR3gujIZxqgbM,https://www.google.com/maps/place/?q=place_id:ChIJQTko3GehkTMR3gujIZxqgbM
BDO Baguio - Abanao Square Branch,Bank,OPERATIONAL,Baguio,Benguet,Cordillera Administrative Region,"Abanao Square, Abanao, corner Zandueta St, Baguio, Benguet, Philippines",16.4141674,120.5941227,2.3,15,ChIJfRUTIXLJlzMR3G8JRtIGd68,https://www.google.com/maps/place/?q=place_id:ChIJfRUTIXLJlzMR3G8JRtIGd68
Banco De Oro - SM City Baguio,Bank,OPERATIONAL,Baguio,Benguet,Cordillera Administrative Region,"UG/F, SM City Baguio, Upper Session Rd, Baguio, Benguet, Philippines",16.4095662,120.5997407,2.7,13,ChIJe6FCVkKhkTMRBvTadlx8fRs,https://www.google.com/maps/place/?q=place_id:ChIJe6FCVkKhkTMRBvTadlx8fRs
BDO Baguio – Leonard Wood Road Branch,Bank,OPERATIONAL,Baguio,Benguet,Cordillera Administrative Region,"ETCC Commercial Complex, Leonard Wood Road Brgy. Cabinet Hill, Baguio, Philippines",16.4122852,120.6055447,4.7,31,ChIJS4hZ_LqhkTMRip0ikY67bf0,https://www.google.com/maps/place/?q=place_id:ChIJS4hZ_LqhkTMRip0ikY67bf0
BDO Baguio - Luneta Branch,Bank,OPERATIONAL,Baguio,Benguet,Cordillera Administrative Region,"Luneta Hill corner Gov. Pack Road, Session Rd, Baguio, Benguet, Philippines",16.4106317,120.5993462,3.2,36,ChIJn0dht0KhkTMRPzJMC7x8NT0,https://www.google.com/maps/place/?q=place_id:ChIJn0dht0KhkTMRPzJMC7x8NT0
BDO Baguio - Kennon Road Branch,Bank,OPERATIONAL,Baguio,Benguet,Cordillera Administrative Region,"9JQ2+P94, C & Triple A Bldg., Kennon Road, corner Parisas St, Baguio, Benguet, Philippines",16.3893539,120.6006285,2.5,12,ChIJ72Kr17TJlzMR9x8aVAOHAeU,https://www.google.com/maps/place/?q=place_id:ChIJ72Kr17TJlzMR9x8aVAOHAeU
"BDO Unibank, Inc.",Bank,OPERATIONAL,Baguio,Benguet,Cordillera Administrative Region,"110 Session Rd, Baguio, Benguet, Philippines",16.4117826,120.5981766,5,1,ChIJS_wHt0KhkTMReazwDs38iWA,https://www.google.com/maps/place/?q=place_id:ChIJS_wHt0KhkTMReazwDs38iWA
BDO Network Bank - Loan Office,Bank,OPERATIONAL,Baguio,Benguet,Cordillera Administrative Region,"1 City Camp Rd, Baguio, 2600 Benguet, Philippines",16.4114544,120.590402,5,1,ChIJ0VyGjoahkTMRYi97kGSuxqo,https://www.google.com/maps/place/?q=place_id:ChIJ0VyGjoahkTMRYi97kGSuxqo
"BDO Unibank, Inc.",Bank,OPERATIONAL,Baguio,Benguet,Cordillera Administrative Region,"CH2R+9QF, Ben Palispis Hwy, Baguio, Benguet, Philippines",16.4009631,120.5919311,3,2,ChIJnfSCmhShkTMRMWzuo_G6vYA,https://www.google.com/maps/place/?q=place_id:ChIJnfSCmhShkTMRMWzuo_G6vYA
"BDO Unibank, Inc.",Bank,OPERATIONAL,Baguio,Benguet,Cordillera Administrative Region,"G/F Centerpoint Plaza, Marcos Highway Brgy, Baguio, Benguet, Philippines",16.3943229,120.5800051,1.7,9,ChIJhzJiuVKhkTMRkKDWhX3NIUI,https://www.google.com/maps/place/?q=place_id:ChIJhzJiuVKhkTMRkKDWhX3NIUI
"BDO Unibank, Inc.",Bank,OPERATIONAL,Baguio,Benguet,Cordillera Administrative Region,"Camp 7, Benguet, Philippines",16.3892806,120.6006542,2.5,2,ChIJNYMXFyOhkTMRqCrxN-ZeAtk,https://www.google.com/maps/place/?q=place_id:ChIJNYMXFyOhkTMRqCrxN-ZeAtk
Xoom Money Transfer - Banco de Oro / EPCI Baguio-Session Road,Bank,OPERATIONAL,Baguio,Benguet,Cordillera Administrative Region,"National Life Building, Session Rd, Baguio, 2600 Benguet, Philippines",16.4121464,120.5977041,1,1,ChIJ-SZnt0KhkTMRQVBWkH4B-zo,https://www.google.com/maps/place/?q=place_id:ChIJ-SZnt0KhkTMRQVBWkH4B-zo
BDO NETWORK BANK - La Trinidad,Bank,OPERATIONAL,La Trinidad,Benguet,Cordillera Administrative Region,"CHWP+7XX, Pico Rd, La Trinidad, Benguet, Philippines",16.4457639,120.5874728,,,ChIJZwpw3XGjkTMRYL8kBSTwFRM,https://www.google.com/maps/place/?q=place_id:ChIJZwpw3XGjkTMRYL8kBSTwFRM
BDO Benguet - Itogon,Bank,OPERATIONAL,Itogon,Benguet,Cordillera Administrative Region,"Brgy. Tuding, National Highway Domilos Compound, G/F, Caligtan-Domilos Building, Purok Domilos Antamok Rd, Itogon, 2604 Benguet, Philippines",16.413382,120.6388589,,,ChIJcza_52inkTMRr5eSuEEp_K8,https://www.google.com/maps/place/?q=place_id:ChIJcza_52inkTMRr5eSuEEp_K8
Banco de Oro Automatic Teller Machine,Bank,OPERATIONAL,Bokod,Benguet,Cordillera Administrative Region,"2/F SM City Baguio, 231, Baguio, Benguet, Philippines",16.5577257,120.8039474,,,ChIJq6qqqqq2kTMRKlNIIbp_PpQ,https://www.google.com/maps/place/?q=place_id:ChIJq6qqqqq2kTMRKlNIIbp_PpQ
BDO network bank,Bank,OPERATIONAL,Alfonso Lista,Ifugao,Cordillera Administrative Region,"XFQR+CG4, Alfonso Lista, Ifugao, Philippines",16.988521,121.4913182,,,ChIJzaTjKAD7jzMRs0nIVIqry9M,https://www.google.com/maps/place/?q=place_id:ChIJzaTjKAD7jzMRs0nIVIqry9M
BDO Network Bank,Bank,OPERATIONAL,Alfonso Lista,Ifugao,Cordillera Administrative Region,"WFCQ+X5J, Burgos, Alfonso Lista, Ifugao, Philippines",16.9224587,121.4878787,,,ChIJPcr-SPT8jzMRJtWbVAtEO-o,https://www.google.com/maps/place/?q=place_id:ChIJPcr-SPT8jzMRJtWbVAtEO-o
BDO,Bank,OPERATIONAL,San Fabian,Pangasinan,Ilocos Region,"San Fabian, Pangasinan, Philippines",16.112625,120.3976407,5,1,ChIJXVpHgy5pkTMRRQrMQQhgzxc,https://www.google.com/maps/place/?q=place_id:ChIJXVpHgy5pkTMRRQrMQQhgzxc
Bdo,ATM,OPERATIONAL,Calasiao,Pangasinan,Ilocos Region,"Calasiao, Pangasinan, Philippines",16.0211313,120.3553,5,5,ChIJQeepIbhCkTMRsv3gkSuCx5I,https://www.google.com/maps/place/?q=place_id:ChIJQeepIbhCkTMRsv3gkSuCx5I
Bdo Network Bank,Bank,OPERATIONAL,City of Tabuk,Kalinga,Cordillera Administrative Region,"City of Tabuk, Kalinga, Philippines",17.4136222,121.44462,,,ChIJketcJ9WajzMRNk7EcuuC9wA,https://www.google.com/maps/place/?q=place_id:ChIJketcJ9WajzMRNk7EcuuC9wA
BDO Paso de Blas - North Expressway Branch,Bank,OPERATIONAL,Valenzuela,NCR,NCR,"97, Valenzuela, 1442 Metro Manila, Philippines",14.7067233,120.990977,2.4,19,ChIJ1SoqJlmxlzMR8iKZIsgsmoU,https://www.google.com/maps/place/?q=place_id:ChIJ1SoqJlmxlzMR8iKZIsgsmoU
