Branch Name,Types,Business Status,City,Province,Region,Address,Latitude,Longitude,Rating,User Ratings Count,Place ID,Google Maps Link
BDO,Bank,OPERATIONAL,Batangas City,Batangas,CALABARZON,"G/F SM City Batangas Barangay, Batangas, Philippines",13.7563665,121.0696905,2.5,26,ChIJl46yjkgFvTMR_6l3KHGZ0tE,https://www.google.com/maps/place/?q=place_id:ChIJl46yjkgFvTMR_6l3KHGZ0tE
BDO Batangas - Diego Silang Branch,Bank,OPERATIONAL,Batangas City,Batangas,CALABARZON,"Tom's Place, Diego Silang St. corner Maria de Jesus, Batangas City, Philippines",13.7580952,121.0563899,4,3,ChIJARMpJCwFvTMR4RVpyrxstnY,https://www.google.com/maps/place/?q=place_id:ChIJARMpJCwFvTMR4RVpyrxstnY
BDO Batangas - Gulod Branch,Bank,OPERATIONAL,Batangas City,Batangas,CALABARZON,"MB Building, Batangas Tabangao-Lobo Road Brgy, Batangas City, 4200 Batangas, Philippines",13.759092,121.0723101,4,2,ChIJaVilkk4FvTMRxuLjpnhD-Qs,https://www.google.com/maps/place/?q=place_id:ChIJaVilkk4FvTMRxuLjpnhD-Qs
BDO Waltermart - Batangas City,Bank,OPERATIONAL,Batangas City,Batangas,CALABARZON,"G/F Waltermart Batangas, P. Burgos St, Brgy. Calicanto Rd, Batangas City, 4200 Batangas, Philippines",13.7640856,121.0560049,,,ChIJB1GiTOgFvTMRvQc0GzL4iZ8,https://www.google.com/maps/place/?q=place_id:ChIJB1GiTOgFvTMRvQc0GzL4iZ8
BDO CLG Batangas,Bank,OPERATIONAL,Batangas City,Batangas,CALABARZON,"Q355+R2C Prudence Bldg, P. Burgos, Batangas City, Batangas, Philippines",13.7595823,121.0575512,4.5,2,ChIJKb89HEIFvTMRVQ0yqqeFixU,https://www.google.com/maps/place/?q=place_id:ChIJKb89HEIFvTMRVQ0yqqeFixU
BDO Batangas - San Juan Branch,Bank,OPERATIONAL,San Juan,Batangas,CALABARZON,"corner Kalayaan St, Marasigan St, San Juan, Philippines",13.824946,121.3930107,2.9,16,ChIJIftqnHU5vTMRFui_X9HQXVk,https://www.google.com/maps/place/?q=place_id:ChIJIftqnHU5vTMRFui_X9HQXVk
BDO Batangas - Bauan Branch,Bank,OPERATIONAL,Bauan,Batangas,CALABARZON,"Near Plaza Ponciana, 47 Kapitan, Kap Ponso Street, Bauan, Batangas, Philippines",13.7904953,121.0100668,1.3,12,ChIJd0VaXF0PvTMRAKRIRVFn0LE,https://www.google.com/maps/place/?q=place_id:ChIJd0VaXF0PvTMRAKRIRVFn0LE
BDO Waltermart Batangas ATM,ATM,OPERATIONAL,Batangas City,Batangas,CALABARZON,"P. Burgos, Brgy. Calicanto Rd, Batangas City, Batangas, Philippines",13.7639654,121.0562711,2,4,ChIJj2CrtBEFvTMRt5--VLTE_Wk,https://www.google.com/maps/place/?q=place_id:ChIJj2CrtBEFvTMRt5--VLTE_Wk
BDO Lipa - Ayala Highway Branch,Bank,OPERATIONAL,Lipa City,Batangas,CALABARZON,"Casa Esperanza Bldg, President Jose P. Laurel Hwy, Lipa City, Batangas, Philippines",13.9426457,121.1524676,3,2,ChIJjR9JlT1tvTMRSHPiKPcqx4I,https://www.google.com/maps/place/?q=place_id:ChIJjR9JlT1tvTMRSHPiKPcqx4I
"BDO Unibank, Inc.",Bank,OPERATIONAL,Batangas City,Batangas,CALABARZON,"Pallocan West, Batangas City, Batangas, Philippines",13.7524553,121.0879674,,,ChIJ_____7YavTMRQAoK-GqZP-I,https://www.google.com/maps/place/?q=place_id:ChIJ_____7YavTMRQAoK-GqZP-I
BDO Lipa - C M Recto Branch,Bank,OPERATIONAL,Lipa City,Batangas,CALABARZON,"131 C.M. Recto Ave, Lipa City, 4218 Batangas, Philippines",13.9406921,121.161536,2.7,7,ChIJrYwSbqNsvTMRSZ8ffNCVIPw,https://www.google.com/maps/place/?q=place_id:ChIJrYwSbqNsvTMRSZ8ffNCVIPw
BDO Lipa - J.P. Laurel Branch,Bank,OPERATIONAL,Lipa City,Batangas,CALABARZON,"President Jose P. Laurel Hwy, Lipa City, Batangas, Philippines",13.9432829,121.1343397,1.4,8,ChIJIf63cgNtvTMRh-XiMloBCZw,https://www.google.com/maps/place/?q=place_id:ChIJIf63cgNtvTMRh-XiMloBCZw
BDO SM City Lipa Branch,Bank,OPERATIONAL,Lipa City,Batangas,CALABARZON,"G/F SM City, Ayala Hwy, Lipa City, Batangas, Philippines",13.9491797,121.1573925,2,16,ChIJU5Rt369tvTMRLRKIMJ5Ua1k,https://www.google.com/maps/place/?q=place_id:ChIJU5Rt369tvTMRLRKIMJ5Ua1k
BDO SM City Lipa,Bank,OPERATIONAL,Lipa City,Batangas,CALABARZON,"Grd. Floor, Brgy, SM City Lipa, Ayala Hwy, Lipa City, Batangas, Philippines",13.9543582,121.1638648,2,1,ChIJRSeGR5tsvTMR_O_i3kQsJr0,https://www.google.com/maps/place/?q=place_id:ChIJRSeGR5tsvTMR_O_i3kQsJr0
BDO Robinson’s Place Lipa,Bank,OPERATIONAL,Lipa City,Batangas,CALABARZON,"Space - 177, National Hwy, Lipa City, Batangas, Philippines",13.9423182,121.1503262,1.7,20,ChIJr6ytHpdsvTMREiJM6vmBfw8,https://www.google.com/maps/place/?q=place_id:ChIJr6ytHpdsvTMREiJM6vmBfw8
BDO Lipa - High 5 Square Branch,Bank,OPERATIONAL,Lipa City,Batangas,CALABARZON,"W5W3+3VX, High 5 Square, Ayala Hwy, Lipa City, Batangas, Philippines",13.9455012,121.1549433,1.8,6,ChIJfQswaSNtvTMRQGvJ7FaySkM,https://www.google.com/maps/place/?q=place_id:ChIJfQswaSNtvTMRQGvJ7FaySkM
BDO Batangas - Lima Technology Center Branch,Bank,OPERATIONAL,Lipa City,Batangas,CALABARZON,"Units R08-S02, Block E, The Outlets at Lima Technology Center, Brgy, Lipa City, 4217 Batangas, Philippines",14.009509,121.1686224,1,10,ChIJcfwt1vRvvTMR7Dmh5Xokn4c,https://www.google.com/maps/place/?q=place_id:ChIJcfwt1vRvvTMR7Dmh5Xokn4c
BDO Lipa - Puregold Branch,Bank,OPERATIONAL,Lipa City,Batangas,CALABARZON,"G/F Puregold Lipa, Gen. Luna St., corner D.P. Laygo st. &, H. La Torre St, Lipa City, Batangas, Philippines",13.9442453,121.1669307,1,6,ChIJHUnh36FsvTMR2uYSNGhzREM,https://www.google.com/maps/place/?q=place_id:ChIJHUnh36FsvTMR2uYSNGhzREM
Banco De Oro,Bank,OPERATIONAL,Lipa City,Batangas,CALABARZON,"W5W3+4WH, Lipa City, Batangas, Philippines",13.9453093,121.1548826,,,ChIJoegZ7r1svTMRhLfbCMB0jnU,https://www.google.com/maps/place/?q=place_id:ChIJoegZ7r1svTMRhLfbCMB0jnU
BDO Lipa - Rotonda,Bank,OPERATIONAL,Quezon City,NCR,NCR,"Ground Floor, BDO Lipa, Rotonda Regional Building, C.M. Recto Ave, Barangay 04, Lipa City, 4217 Batangas, Philippines",13.9406483,121.1601222,,,ChIJ9VFpSgZtvTMRPuHGOhVcV7I,https://www.google.com/maps/place/?q=place_id:ChIJ9VFpSgZtvTMRPuHGOhVcV7I
BDO Tanauan - JP Laurel Highway Branch,Bank,OPERATIONAL,Tanauan City,Batangas,CALABARZON,"President J.P. Laurel Highway, corner Sixto Castillo St, Tanauan City, Batangas, Philippines",14.0831746,121.1501309,3.7,12,ChIJkZrNul1vvTMRh-xY5bWNukM,https://www.google.com/maps/place/?q=place_id:ChIJkZrNul1vvTMRh-xY5bWNukM
BDO Waltermart - Tanauan,Bank,OPERATIONAL,Tanauan City,Batangas,CALABARZON,"JP Laurel Nat'l Hwy, Tanauan City, Batangas, Philippines",14.0744013,121.1506931,1.8,5,ChIJT3pUSmRvvTMRoshhdf46bG8,https://www.google.com/maps/place/?q=place_id:ChIJT3pUSmRvvTMRoshhdf46bG8
BDO,ATM,OPERATIONAL,Tanauan City,Batangas,CALABARZON,"B President Jose P. Laurel Hwy, Tanauan City, Batangas, Philippines",14.0746457,121.1510025,3,6,ChIJTyUVdkFvvTMRwnrMOb1DqtM,https://www.google.com/maps/place/?q=place_id:ChIJTyUVdkFvvTMRwnrMOb1DqtM
BDO Batangas - First Phil. Industrial Park,Bank,OPERATIONAL,Santo Tomas,Batangas,CALABARZON,"Santo Tomas, Batangas, Philippines",14.1367058,121.1316715,,,ChIJ-bxDnDdlvTMRnL7yAsCeuWo,https://www.google.com/maps/place/?q=place_id:ChIJ-bxDnDdlvTMRnL7yAsCeuWo
BDO Batangas - Lemery Xentro Mall Branch,Bank,OPERATIONAL,Lemery,Batangas,CALABARZON,"G/F Xentro Mall Lemery Brgy, Lemery, Batangas, Philippines",13.8964733,120.9047661,1,2,ChIJQ8cslzELvTMRfa_ha4oIYuw,https://www.google.com/maps/place/?q=place_id:ChIJQ8cslzELvTMRfa_ha4oIYuw
BDO Batangas - Lemery Ilustre,Bank,OPERATIONAL,Lemery,Batangas,CALABARZON,"Brgy, Ilustre Avenue, cor Lakandula, Lemery, 4209 Batangas, Philippines",13.8828703,120.9143362,3,8,ChIJR9Lkzh4KvTMRJm3LVdf23Ic,https://www.google.com/maps/place/?q=place_id:ChIJR9Lkzh4KvTMRJm3LVdf23Ic
BDO SM Center Lemery Branch,Bank,OPERATIONAL,Lemery,Batangas,CALABARZON,"GF, Ilustre Ave, SM Center, P Gomez, District IV, Lemery, Batangas, Philippines",13.8868972,120.9119915,3.4,5,ChIJIVM-JccLvTMR_hnroZjYpLQ,https://www.google.com/maps/place/?q=place_id:ChIJIVM-JccLvTMR_hnroZjYpLQ
BDO Network Bank,Bank,OPERATIONAL,Cuenca,Batangas,CALABARZON,"V2XX+6JF, N433, Cuenca, Batangas, Philippines",13.8980679,121.0491089,5,2,ChIJy_1O0R8NvTMR9RA-U0-tYH0,https://www.google.com/maps/place/?q=place_id:ChIJy_1O0R8NvTMR9RA-U0-tYH0
BDO Batangas - Balayan Branch,Bank,OPERATIONAL,Balayan,Batangas,CALABARZON,"Antorcha St, Balayan, Batangas, Philippines",13.9392846,120.7312633,3,7,ChIJy--ybyGjvTMRbSrXkYabqis,https://www.google.com/maps/place/?q=place_id:ChIJy--ybyGjvTMRbSrXkYabqis
BDO Waltermart - Balayan Branch,Bank,OPERATIONAL,Balayan,Batangas,CALABARZON,"G/F Waltermart Balayan Balibago-Balayan Highway, corner Paz St, Balayan, Batangas, Philippines",13.9495776,120.7291948,3.1,9,ChIJJZZv-NuivTMR82RFvBF9g6w,https://www.google.com/maps/place/?q=place_id:ChIJJZZv-NuivTMR82RFvBF9g6w
BDO ATM - Fiesta World Mall,Bank,OPERATIONAL,Lipa City,Batangas,CALABARZON,"G/F Bldg. B., Fiesta World Mall, Lipa City, Batangas, Philippines",13.9617543,121.1690343,1,1,ChIJTcRtRIBsvTMR1vevn6rYxuA,https://www.google.com/maps/place/?q=place_id:ChIJTcRtRIBsvTMR1vevn6rYxuA
BDO Foodsphere Batangas 1 ATM,ATM,OPERATIONAL,Malvar,Batangas,CALABARZON,"Foodsphere Batangas Plant, Canteen Area Plant 3, San Isidro Barangay Rd, Malvar, Batangas, Philippines",14.0390696,121.1253539,1,1,ChIJ1Z19Z5dvvTMRS4pa4dxuvEc,https://www.google.com/maps/place/?q=place_id:ChIJ1Z19Z5dvvTMRS4pa4dxuvEc
BDO Network Bank,Bank,OPERATIONAL,Calatagan,Batangas,CALABARZON,"153 Castueras, Calatagan, 4215 Batangas, Philippines",13.8339979,120.6316078,,,ChIJfwFmfQC7vTMR7NdKjzZrn2I,https://www.google.com/maps/place/?q=place_id:ChIJfwFmfQC7vTMR7NdKjzZrn2I
BDO Ibaan Electric Company ATM,ATM,OPERATIONAL,Ibaan,Batangas,CALABARZON,"Metro-Rei Business Park, G/F Lobby, IEC Ibaan Electric Company Ibaan Electric Corporation Office, Bldg. A, Ibaan, Batangas, Philippines",13.834403,121.1301382,,,ChIJGTTKPbERvTMRGKfUXd3myeY,https://www.google.com/maps/place/?q=place_id:ChIJGTTKPbERvTMRGKfUXd3myeY
BDO Toreja's Construction Supply Corporation,ATM,OPERATIONAL,Ibaan,Batangas,CALABARZON,"G/F Inside Office Bldg., Toreja's Construction Supply Corporation No. 5 Brgy, Ibaan, Batangas, Philippines",13.8362656,121.140951,,,ChIJYds6icIRvTMRKeavp-Pkv1s,https://www.google.com/maps/place/?q=place_id:ChIJYds6icIRvTMRKeavp-Pkv1s
BDO SM Hypermarket Rosario Batangas 1 ATM,ATM,OPERATIONAL,Ibaan,Batangas,CALABARZON,"SM Hypermarket, G/F Hypermarket Selling Area Entrance, Rosario - Ibaan Rd, Rosario, Batangas, Philippines",13.8310198,121.1684977,1,1,ChIJPW3Fd3IRvTMRBey0Bha78WY,https://www.google.com/maps/place/?q=place_id:ChIJPW3Fd3IRvTMRBey0Bha78WY
BDO TCSC Corp. - Ibaan ATM,ATM,OPERATIONAL,Bauan,Batangas,CALABARZON,"Ground floor, Main Security Office, Brgy Lapu Lapu, Ibaan, 4230 Batangas, Philippines",13.8245155,120.9931411,,,ChIJ63K-SU8PvTMRHa_h5Z9JDCk,https://www.google.com/maps/place/?q=place_id:ChIJ63K-SU8PvTMRHa_h5Z9JDCk
Bdo Network Bank,Bank,OPERATIONAL,San Jose,Batangas,CALABARZON,"V4H4+FH8, Makalintal Ave, San Jose, Batangas, Philippines",13.8786372,121.1064587,4,2,ChIJazyODEMSvTMRjfXiy62LBXM,https://www.google.com/maps/place/?q=place_id:ChIJazyODEMSvTMRjfXiy62LBXM
BDO Batangas - Bauan Poblacion 2,Bank,OPERATIONAL,Bauan,Batangas,CALABARZON,"Brgy, Kapitan Ponso St, Cor Sta. Cruz, Poblacion 2, Bauan, 4201 Batangas, Philippines",13.7903644,121.0080109,1,1,ChIJjzL6rKAPvTMRyZ-vNPc4P1U,https://www.google.com/maps/place/?q=place_id:ChIJjzL6rKAPvTMRyZ-vNPc4P1U
BDO ATM - CADP Nasugbu,Bank,OPERATIONAL,Nasugbu,Batangas,CALABARZON,"G/F Radio Room, Don Pedro Azucarera, Nasugbu, Batangas, Philippines",14.0510837,120.6659003,5,1,ChIJ5TjryVSRvTMRDaWN81tWi1I,https://www.google.com/maps/place/?q=place_id:ChIJ5TjryVSRvTMRDaWN81tWi1I
Banco De Oro,Bank,OPERATIONAL,Mabini,Batangas,CALABARZON,"QW3R+24P, Mabini, Batangas, Philippines",13.7525976,120.9403318,,,ChIJD47OIasHvTMRdoaARKV7dcY,https://www.google.com/maps/place/?q=place_id:ChIJD47OIasHvTMRdoaARKV7dcY
BDO Leon Guinto - Gen. Malvar Branch,Bank,OPERATIONAL,Manila,NCR,NCR,"Zone 075, Wynn Plaza Commercial Unit 2 1674 Leon Guinto cor. Gen. Malvar &, Agoncillo St, Malate, Metro Manila, Philippines",14.5753884,120.9899914,3.7,3,ChIJcfcZ9KnJlzMRYajdeFs7C9A,https://www.google.com/maps/place/?q=place_id:ChIJcfcZ9KnJlzMRYajdeFs7C9A
BDO Haven of Infinity Memorial Gardens ATM,ATM,OPERATIONAL,Lipa City,Batangas,CALABARZON,"Memorial Gardens, Haven of Infinity Memorial Park, President Jose P. Laurel Hwy, Brgy, Lipa City, 4217 Batangas, Philippines",13.9254148,121.1060547,,,ChIJIVDTPIgTvTMRQ5zdsCFqKHM,https://www.google.com/maps/place/?q=place_id:ChIJIVDTPIgTvTMRQ5zdsCFqKHM
BDO ATM,Bank,OPERATIONAL,Rosario,Batangas,CALABARZON,"R6W3+33G, BDO Bldg. G. Carandang St. cor. V. Noble Alley & near cor. Gualberto St., Rosario, Batangas, Carandang Street, Rosario, 4225 Batangas, Philippines",13.8451825,121.2027084,3.5,2,ChIJ9dJ_HiUUvTMRbUYMkpb_etQ,https://www.google.com/maps/place/?q=place_id:ChIJ9dJ_HiUUvTMRbUYMkpb_etQ
BDO Savemore San Jose Batangas ATM,ATM,OPERATIONAL,San Jose,Batangas,CALABARZON,"G/F, Savemore, Barangay, San Jose, 4227 Batangas, Philippines",13.8787051,121.101521,,,ChIJo0_fxMMTvTMRWivJ1sP4cAg,https://www.google.com/maps/place/?q=place_id:ChIJo0_fxMMTvTMRWivJ1sP4cAg
BDO Waltermart - San Pascual Batangas,Bank,OPERATIONAL,San Pascual,Batangas,CALABARZON,"Ground Floor, Waltermart, Lumang Kalye, Barangay San Antonio, San Pascual, 4204 Batangas, Philippines",13.7880636,121.0203758,,,ChIJMRsOeMIPvTMR1__OWeJvodQ,https://www.google.com/maps/place/?q=place_id:ChIJMRsOeMIPvTMR1__OWeJvodQ
BDO Taal,Bank,OPERATIONAL,Taal,Batangas,CALABARZON,"VWHF+V3F, Calle Ananias Diokno, Taal, Batangas, Philippines",13.8797424,120.9226672,,,ChIJpVuDyzULvTMRAFbjFhyMxL8,https://www.google.com/maps/place/?q=place_id:ChIJpVuDyzULvTMRAFbjFhyMxL8
BDO Network Bank,Bank,OPERATIONAL,Taysan,Batangas,CALABARZON,"Q5VQ+XRM, Taysan-Rosario Rd, Taysan, Batangas, Philippines",13.794955,121.1895611,,,ChIJc2I_3iAXvTMRNveGIDyTg6M,https://www.google.com/maps/place/?q=place_id:ChIJc2I_3iAXvTMRNveGIDyTg6M
BDO Network Bank,Bank,OPERATIONAL,Tuy,Batangas,CALABARZON,"Tuy, Batangas, Philippines",14.0146911,120.727361,,,ChIJR7VqRDqYvTMRH2CwHhwCEdQ,https://www.google.com/maps/place/?q=place_id:ChIJR7VqRDqYvTMRH2CwHhwCEdQ
BDO SM Center Antipolo Downtown,Bank,OPERATIONAL,Antipolo City,Rizal,CALABARZON,"UGF 122, 123 & 124, Foodarama, Sm cherry mall, Marikina-Infanta Hwy, Brgy, Antipolo City, 1870 Metro Manila, Philippines",14.6247569,121.1340103,2.1,20,ChIJQVUgcMiVlzMR8yekZR4QT0M,https://www.google.com/maps/place/?q=place_id:ChIJQVUgcMiVlzMR8yekZR4QT0M
BDO Antipolo - Xentro Mall,Bank,OPERATIONAL,Antipolo City,Rizal,CALABARZON,"LS01-03, Brgy, Xentro Mall Antipolo, Sumulong Hwy, Antipolo City, 1870 Rizal, Philippines",14.6169666,121.1352301,3.2,11,ChIJabO1ki65lzMRdVvXQhZawIE,https://www.google.com/maps/place/?q=place_id:ChIJabO1ki65lzMRdVvXQhZawIE
BDO Waltermart - Antipolo,Bank,OPERATIONAL,Antipolo City,Rizal,CALABARZON,"H5JF+25H, L. Sumulong Memorial Circle, Antipolo City, 1870 Rizal, Philippines",14.5800875,121.1730373,1.8,12,ChIJ7-Q9iXbBlzMRNKkG6vNVUk4,https://www.google.com/maps/place/?q=place_id:ChIJ7-Q9iXbBlzMRNKkG6vNVUk4
BDO Antipolo - B. V. Soliven Branch,Bank,OPERATIONAL,Antipolo City,Rizal,CALABARZON,"Blk 21, J4MC+MMM, Blk 24, Lot 1, Benito V. Soliven Avenue Greenheights Subd Barangay, Lot 3 Hon. B. Soliven Ave, Antipolo City, 1800 Rizal, Philippines",14.634376,121.1216833,3.5,11,ChIJIb7VQjq5lzMRFdSTsYAMcdA,https://www.google.com/maps/place/?q=place_id:ChIJIb7VQjq5lzMRFdSTsYAMcdA
Bdo Network Bank,Bank,OPERATIONAL,Antipolo City,Rizal,CALABARZON,"J59C+29M, National Housing Authority Ave, Antipolo City, 1870 Rizal, Philippines",14.6176094,121.1709102,3.3,4,ChIJDb5vNdO4lzMRQ-bctuiLCys,https://www.google.com/maps/place/?q=place_id:ChIJDb5vNdO4lzMRQ-bctuiLCys
BDO Antipolo Plaza Branch CDM,ATM,OPERATIONAL,Antipolo City,Rizal,CALABARZON,"Gatsby Bldg, 11 M.L. Quezon Street, Antipolo City, 1870 Rizal, Philippines",14.5868998,121.1756075,5,1,ChIJUZECU-2_lzMRQmRdXEII1z8,https://www.google.com/maps/place/?q=place_id:ChIJUZECU-2_lzMRQmRdXEII1z8
BDO SM City Masinag Branch,Bank,OPERATIONAL,Antipolo City,Rizal,CALABARZON,"G/F SM City Masinag, Marikina-Infanta Hwy, Antipolo City, Rizal, Philippines",14.6254126,121.1199231,2.2,39,ChIJl3pBxWmVlzMRC7JX0oRGLxk,https://www.google.com/maps/place/?q=place_id:ChIJl3pBxWmVlzMRC7JX0oRGLxk
BDO Antipolo Plaza Branch ATM 2,ATM,OPERATIONAL,Antipolo City,Rizal,CALABARZON,"Gatsby Bldg, 11 M.L. Quezon Street, Antipolo City, 1870 Rizal, Philippines",14.5868998,121.1756075,3.7,3,ChIJc8L1qQq_lzMRhBHiig5pA2U,https://www.google.com/maps/place/?q=place_id:ChIJc8L1qQq_lzMRhBHiig5pA2U
BDO ATM,ATM,OPERATIONAL,Antipolo City,Rizal,CALABARZON,"H5WF+223, Robinsons Place Antipolo, Sumulong Hwy, Antipolo City, 1870 Lalawigan ng Rizal, Philippines",14.5950138,121.1725333,5,1,ChIJJYYE5Uy_lzMRb824TQXfauM,https://www.google.com/maps/place/?q=place_id:ChIJJYYE5Uy_lzMRb824TQXfauM
BDO Marikina Sumulong,Bank,OPERATIONAL,Marikina,NCR,NCR,"J3PW+6JJ, Sumulong Hwy, Marikina, 1800 Metro Manila, Philippines",14.6356328,121.0965126,2.3,16,ChIJ-dsxqMy5lzMRWk8JUZlgc3g,https://www.google.com/maps/place/?q=place_id:ChIJ-dsxqMy5lzMRWk8JUZlgc3g
BDO Network Bank,Bank,OPERATIONAL,Angono,Rizal,CALABARZON,"61 Col. Guido, Angono, 1930 Lalawigan ng Rizal, Philippines",14.5233598,121.1546728,5,3,ChIJ3zZn2HnHlzMR9trFK6lEBLo,https://www.google.com/maps/place/?q=place_id:ChIJ3zZn2HnHlzMR9trFK6lEBLo
BDO Angono - National Highway,Bank,OPERATIONAL,Angono,Rizal,CALABARZON,"Lot 3, Brgy, Blk.4 M.L. Quezon St, Angono, 1930 Rizal, Philippines",14.5379683,121.1515325,,,ChIJi0f0Q6vHlzMRQQBMdEefAoA,https://www.google.com/maps/place/?q=place_id:ChIJi0f0Q6vHlzMRQQBMdEefAoA
Banco De Oro Unibank,Bank,OPERATIONAL,Angono,Rizal,CALABARZON,"SM Angono, Angono, Rizal, Philippines",14.5305324,121.1552075,,,ChIJ8VG2YMTGlzMRqIQAbFwlR3E,https://www.google.com/maps/place/?q=place_id:ChIJ8VG2YMTGlzMRqIQAbFwlR3E
BDO Angono-M.L. Quezon Ave. Branch ATM 2,ATM,OPERATIONAL,Angono,Rizal,CALABARZON,"GF AB Commercial Plaza, M.L. Quezon St, Angono, Rizal, Philippines",14.5266665,121.1543979,5,1,ChIJHWjbUajHlzMRS4mfqyXaBt4,https://www.google.com/maps/place/?q=place_id:ChIJHWjbUajHlzMRS4mfqyXaBt4
BDO ATM - Angono-National Highway,Bank,OPERATIONAL,Angono,Rizal,CALABARZON,"Manila E Rd, Angono, Rizal, Philippines",14.5378862,121.1484751,2.3,10,ChIJfyEOj93GlzMR1qiKOwHOi10,https://www.google.com/maps/place/?q=place_id:ChIJfyEOj93GlzMR1qiKOwHOi10
BDO Angono-National Highway Branch ATM 2,ATM,OPERATIONAL,Angono,Rizal,CALABARZON,"GF AB Commercial Plaza, M.L. Quezon St, Angono, Rizal, Philippines",14.5266665,121.1543979,,,ChIJY8KF6NDHlzMRqEhePCRKxns,https://www.google.com/maps/place/?q=place_id:ChIJY8KF6NDHlzMRqEhePCRKxns
BDO ATM - Savemore Tanay,Bank,OPERATIONAL,Tanay,Rizal,CALABARZON,"F7WR+899, Sampaloc Rd, Tanay, Rizal, Philippines",14.4957972,121.2909846,1,3,ChIJ919NfzvqlzMRysKPQ18rTU4,https://www.google.com/maps/place/?q=place_id:ChIJ919NfzvqlzMRysKPQ18rTU4
BDO Taytay - National Highway Branch,Bank,OPERATIONAL,Taytay,Rizal,CALABARZON,"Korte Rosario Restaurant, National Highway, Sitio Ilog Pugad, Taytay, Rizal, Philippines",14.5532851,121.1384394,3.4,15,ChIJkUjm8znHlzMRlTiMd74n868,https://www.google.com/maps/place/?q=place_id:ChIJkUjm8znHlzMRlTiMd74n868
BDO Taytay - Manila East Road Branch,Bank,OPERATIONAL,Taytay,Rizal,CALABARZON,"Taytay Diversion Rd, Taytay, 1920 Rizal, Philippines",14.5584849,121.1365836,2.8,26,ChIJPwX32A_HlzMRveZFDlIWOwo,https://www.google.com/maps/place/?q=place_id:ChIJPwX32A_HlzMRveZFDlIWOwo
BDO Montalban - Puregold Branch,Bank,OPERATIONAL,Rodriguez,Rizal,CALABARZON,"G/F Units 3, 5 Rodriguez Hwy, Rodriguez, Rizal, Philippines",14.7298697,121.1402564,2.1,14,ChIJvYpPWxa7lzMR_wASGCCd9Bo,https://www.google.com/maps/place/?q=place_id:ChIJvYpPWxa7lzMR_wASGCCd9Bo
BDO SM San Mateo Branch,Bank,OPERATIONAL,San Mateo,NCR,NCR,"Unit 125-126, G/F SM City San Mateo Gen. Luna Brgy, San Mateo, 1850 Rizal, Philippines",14.679936,121.1143515,2.7,53,ChIJSWqXACa6lzMRRUxznB1OEBM,https://www.google.com/maps/place/?q=place_id:ChIJSWqXACa6lzMRRUxznB1OEBM
BDO SM City - Taytay Branch,Bank,OPERATIONAL,Taytay,Rizal,CALABARZON,"G/F Bldg. A, SM City Taytay, Manila E Rd, Taytay, Rizal, Philippines",14.5653452,121.1408651,2.3,28,ChIJK9K8PxPHlzMRAksvvPmsMDg,https://www.google.com/maps/place/?q=place_id:ChIJK9K8PxPHlzMRAksvvPmsMDg
BDO,ATM,OPERATIONAL,Taytay,Rizal,CALABARZON,"SM Taytay, Manila East Road, Dolores, Taytay, 1920 Rizal, Philippines",14.564586,121.139439,5,1,ChIJoXrQ7xLHlzMRgFUAk04IuYI,https://www.google.com/maps/place/?q=place_id:ChIJoXrQ7xLHlzMRgFUAk04IuYI
BDO Waltermart,Bank,OPERATIONAL,Taytay,Rizal,CALABARZON,"H4HQ+R4H, Ortigas Ave, Taytay, 1920 Rizal, Philippines",14.5795545,121.1378594,1,3,ChIJL0Ii-0fHlzMRz52AqzH8Zws,https://www.google.com/maps/place/?q=place_id:ChIJL0Ii-0fHlzMRz52AqzH8Zws
BDO Lucena - Quezon Avenue Branch,Bank,OPERATIONAL,Lucena City,Quezon,CALABARZON,"Quezon Avenue, corner Profugo St, Lucena City, 4301 Quezon, Philippines",13.9354066,121.6129587,3.8,17,ChIJE4Z0vFtLvTMRjuIGHKSzd9c,https://www.google.com/maps/place/?q=place_id:ChIJE4Z0vFtLvTMRjuIGHKSzd9c
BDO Lucena - Gulang-Gulang Branch,Bank,OPERATIONAL,Lucena City,Quezon,CALABARZON,"505 Quezon Ave, Lucena City, 4301 Quezon, Philippines",13.9434176,121.6136923,2.8,5,ChIJ2bWLp6dMvTMRc44l6d4D8sA,https://www.google.com/maps/place/?q=place_id:ChIJ2bWLp6dMvTMRc44l6d4D8sA
BDO SM City Lucena Branch,Bank,OPERATIONAL,Lucena City,Quezon,CALABARZON,"G/F SM City Lucena, (LC 177-178), Pagbilao National Road, Lucena City, Quezon, Philippines",13.9402804,121.6246121,3.8,18,ChIJC89heqpMvTMRNttaCvfoHDA,https://www.google.com/maps/place/?q=place_id:ChIJC89heqpMvTMRNttaCvfoHDA
BDO Lucena - Merchan Branch,Bank,OPERATIONAL,Lucena City,Quezon,CALABARZON,"Lot 2903 Merchan St. cor. C.M. Recto St, cor Cabana St, Lucena City, 4301, Philippines",13.9371242,121.6144302,2.7,6,ChIJF2VHNvNLvTMR5ltkmL_rw5g,https://www.google.com/maps/place/?q=place_id:ChIJF2VHNvNLvTMR5ltkmL_rw5g
BDO Lucena - Iyam Branch,Bank,OPERATIONAL,Lucena City,Quezon,CALABARZON,"Rosario Village, Space 4-6, Kester Bldg., Maharlika Highway corner Love St, Subd., Brgy, Lucena City, Philippines",13.9380275,121.5986577,3.5,8,ChIJNb_IJUtLvTMRi8_RNCSB6Qo,https://www.google.com/maps/place/?q=place_id:ChIJNb_IJUtLvTMRi8_RNCSB6Qo
BDO Lucena - Enriquez Branch,Bank,OPERATIONAL,Lucena City,Quezon,CALABARZON,"Enriquez corner, Evangelista St, Lucena City, 4301 Quezon, Philippines",13.9327242,121.6131922,4,4,ChIJxSZfvXNLvTMRlQ_ToVofxFo,https://www.google.com/maps/place/?q=place_id:ChIJxSZfvXNLvTMRlQ_ToVofxFo
BDO Lucena - Mayao,Bank,OPERATIONAL,Lucena City,Quezon,CALABARZON,"Units 1 to 4, G/F, Brgy, JM-A Building, Lucena City, 4301 Quezon, Philippines",13.9486418,121.6374291,3.5,11,ChIJO27WKFCzojMRnyb76in-6IA,https://www.google.com/maps/place/?q=place_id:ChIJO27WKFCzojMRnyb76in-6IA
BDO Lucena - Tagarao Branch,ATM,OPERATIONAL,Lucena City,Quezon,CALABARZON,"M. L. Tagarao Street, Lucena City, 4301 Quezon, Philippines",13.9367182,121.6097655,2,4,ChIJAb_wFVxLvTMRo5ht2BZ3SOg,https://www.google.com/maps/place/?q=place_id:ChIJAb_wFVxLvTMRo5ht2BZ3SOg
BDO - Hermana Fausta Branch,Bank,OPERATIONAL,Lucena City,Quezon,CALABARZON,"56 Quezon Ave, Lucena City, 4301 Quezon, Philippines",13.9398959,121.6133945,,,ChIJ49_ldQBLvTMR09QgiDNgprA,https://www.google.com/maps/place/?q=place_id:ChIJ49_ldQBLvTMR09QgiDNgprA
BDO Regional HQ - Quezon Province,Bank,OPERATIONAL,Lucena City,Quezon,CALABARZON,"WJP7+RR4, Lucena City, 4301 Quezon, Philippines",13.9370033,121.6145714,4,1,ChIJU_0Ah1lLvTMRQTA3cdLjiaI,https://www.google.com/maps/place/?q=place_id:ChIJU_0Ah1lLvTMRQTA3cdLjiaI
BDO Quezon - Gumaca Branch,Bank,OPERATIONAL,Gumaca,Quezon,CALABARZON,"JT Bldg, 1, Gumaca, Quezon, Philippines",13.9234427,122.098159,2.8,11,ChIJQYV218SQojMRM9jmAiJWx4E,https://www.google.com/maps/place/?q=place_id:ChIJQYV218SQojMRM9jmAiJWx4E
Bdo Network Bank,Bank,OPERATIONAL,Atimonan,Quezon,CALABARZON,"2W39+2P2, Manuel L. Quezon St, Atimonan, Quezon, Philippines",14.0024952,121.9192456,5,1,ChIJpbFFLWqjojMROLOADwdD424,https://www.google.com/maps/place/?q=place_id:ChIJpbFFLWqjojMROLOADwdD424
BDO Tagkawayan,Bank,OPERATIONAL,Tagkawayan,Quezon,CALABARZON,"XGCQ+557, Brgy, Tagkawayan, Quezon, Philippines",13.9704506,122.5378849,5,1,ChIJA4iwf2x3ojMR9BLzboCIvrE,https://www.google.com/maps/place/?q=place_id:ChIJA4iwf2x3ojMR9BLzboCIvrE
BDO Banawe - Agno Branch,Bank,OPERATIONAL,Quezon City,NCR,NCR,"202-204 Banaue, Cor Agno, Quezon City, 1113 Metro Manila, Philippines",14.6227921,121.0089054,4.7,3,ChIJBXjT3BW2lzMRhUU_Y2pqW1E,https://www.google.com/maps/place/?q=place_id:ChIJBXjT3BW2lzMRhUU_Y2pqW1E
BDO Quezon - Candelaria Branch,Bank,OPERATIONAL,Candelaria,Quezon,CALABARZON,"Rizal corner, Del Valle St, Candelaria, Quezon, Philippines",13.9285101,121.4235842,2.5,11,ChIJb5HXTDVGvTMRGhoxFmn2kVg,https://www.google.com/maps/place/?q=place_id:ChIJb5HXTDVGvTMRGhoxFmn2kVg
BDO Network Bank,Bank,OPERATIONAL,Catanauan,Quezon,CALABARZON,"H8RH+MJR, Catanauan, Quezon, Philippines",13.5917358,122.3290316,4,2,ChIJEfUHfOX5ojMRupMhaCNOG1g,https://www.google.com/maps/place/?q=place_id:ChIJEfUHfOX5ojMRupMhaCNOG1g
BDO Banawe - Kitanlad Branch,Bank,OPERATIONAL,Quezon City,NCR,NCR,"23-25, Banawe Avenue, corner Kitanlad, Quezon City, Philippines",14.6191073,121.0096627,4.1,18,ChIJj2rTzRe2lzMRstUcVmqqYkE,https://www.google.com/maps/place/?q=place_id:ChIJj2rTzRe2lzMRstUcVmqqYkE
BDO EDSA - New Farmers Plaza Branch,Bank,OPERATIONAL,Quezon City,NCR,NCR,"G/F, New Farmers Plaza, Araneta City, General Roxas Ave, Cubao, Quezon City, 1109 Kalakhang Maynila, Philippines",14.6212319,121.0522435,2.1,15,ChIJNRATu8C3lzMRe6OC5Va-Pmk,https://www.google.com/maps/place/?q=place_id:ChIJNRATu8C3lzMRe6OC5Va-Pmk
BDO SM Araneta City Branch,Bank,OPERATIONAL,Quezon City,NCR,NCR,"G/F, SM Araneta City Araneta Center, Cubao, Quezon City, 1109 Metro Manila, Philippines",14.6197418,121.0549727,2.7,62,ChIJ1zJBF8C3lzMRQ3dfA5slbcQ,https://www.google.com/maps/place/?q=place_id:ChIJ1zJBF8C3lzMRQ3dfA5slbcQ
BDO Branch E. Rodriguez Sr. - Hillcrest,Bank,OPERATIONAL,Quezon City,NCR,NCR,"G/F Rhodium Square Bdlg., 1659 E. Rodriguez Sr. Avenue, Quezon City, 1112 Metro Manila, Philippines",14.6247502,121.0421217,2.1,18,ChIJc5j3d8-3lzMRU5Kfsfmp3Sw,https://www.google.com/maps/place/?q=place_id:ChIJc5j3d8-3lzMRU5Kfsfmp3Sw
